Place,Date,tempmax,tempmin,temp,feelslikemax,feelslikemin,feelslike,dew,humidity,precip,precipprob,precipcover,preciptype,snow,snowdepth,windgust,windspeed,winddir,sealevelpressure,cloudcover,visibility,solarradiation,solarenergy,uvindex,severerisk,sunrise,sunset,moonphase,conditions,description,icon,stations
Chennai,01/1/15,29.1,23.1,26.1,33.7,23.1,27.9,23.9,88.1,0.4,100,4.17,rain,0,0,22.3,11.2,118,1008.8,45.5,4.7,163.7,14.1,7,,2015-01-01 6:31:09,2015-01-01 17:53:17,0.36,"Rain, Partially cloudy",Partly cloudy throughout the day with afternoon rain.,ğŸŒ§ï¸,"43279099999,remote"
Chennai,02/1/15,31.1,23.1,26.6,37.9,23.1,29.1,24.5,89.1,0.1,100,4.17,rain,0,0,25.6,20.5,132.6,1011.1,41.2,4.5,190.7,16.4,7,,2015-01-02 6:31:32,2015-01-02 17:53:51,0.4,"Rain, Partially cloudy",Partly cloudy throughout the day with morning rain.,ğŸŒ§ï¸,"43279099999,remote"
Chennai,03/1/15,31.1,25.1,27.1,36.7,25.1,29.2,24.4,86.1,0.4,100,8.33,rain,0,0,24.8,18.4,124.5,1012.5,41.1,5,158.5,13.6,6,,2015-01-03 6:31:54,2015-01-03 17:54:25,0.43,"Rain, Partially cloudy",Partly cloudy throughout the day with rain clearing later.,ğŸŒ§ï¸,"43279099999,remote"
Chennai,04/1/15,30.1,23.1,26.2,34.3,23.1,27.6,23.5,86,0.4,100,8.33,rain,0,0,20.5,14.8,71.4,1012.5,35,4.8,171.1,14.8,6,,2015-01-04 6:32:15,2015-01-04 17:54:59,0.47,"Rain, Partially cloudy",Partly cloudy throughout the day with rain clearing later.,ğŸŒ§ï¸,"43279099999,remote"
Chennai,05/1/15,31.1,23.1,26.5,33.8,23.1,27.7,23,82.5,0,0,0,,0,0,25.9,20.5,30.5,1012.2,38.3,5.4,207.8,17.9,8,,2015-01-05 6:32:36,2015-01-05 17:55:33,0.5,Partially cloudy,Partly cloudy throughout the day.,â›…,4.33E+10
Chennai,06/1/15,30.1,23.1,25.8,33.4,23.1,26.7,22.8,84.5,0,0,0,,0,0,23,16.6,24.5,1012.6,36.6,5.3,193.6,16.7,7,,2015-01-06 6:32:55,2015-01-06 17:56:07,0.53,Partially cloudy,Partly cloudy throughout the day.,â›…,"43279099999,remote"
Chennai,07/1/15,30.1,23.1,25.4,34.3,23.1,26.4,22.9,87.1,0,0,0,,0,0,20.5,18.4,58.4,1012.5,43.5,3.7,194.9,16.8,7,,2015-01-07 6:33:14,2015-01-07 17:56:41,0.57,Partially cloudy,Partly cloudy throughout the day.,â›…,"43279099999,remote"
Chennai,08/1/15,30.1,22.1,25.7,33.4,22.1,26.8,22.5,83.6,0,0,0,,0,0,18,18.4,104,1012.8,38.3,3.9,166.4,14.3,6,,2015-01-08 6:33:31,2015-01-08 17:57:15,0.6,Partially cloudy,Partly cloudy throughout the day.,â›…,4.33E+10
Chennai,09/1/15,28.1,23.1,25.2,31.4,23.1,26,22.1,83.7,0,0,0,,0,0,29.2,18.4,43.9,1014.1,46.7,3.9,171.9,14.9,7,,2015-01-09 6:33:48,2015-01-09 17:57:49,0.63,Partially cloudy,Partly cloudy throughout the day.,â›…,4.33E+10
Chennai,10/1/15,29.1,20.1,24.1,28.9,20.1,24.1,17.5,68.8,0,0,0,,0,0,33.1,18.4,10.5,1014.5,31.7,5.1,236.2,20.2,8,,2015-01-10 6:34:04,2015-01-10 17:58:23,0.67,Partially cloudy,Partly cloudy throughout the day.,â›…,4.33E+10
Chennai,11/1/15,29.1,20.1,24.4,29.2,20.1,24.4,18.1,70.1,0,0,0,,0,0,30.2,18.4,29.6,1014.6,46.7,5.1,177.8,15.4,6,,2015-01-11 6:34:19,2015-01-11 17:58:57,0.7,Partially cloudy,Partly cloudy throughout the day.,â›…,4.33E+10
Chennai,12/1/15,29.1,20.1,24,29.5,20.1,24.1,18.1,71.2,0,0,0,,0,0,34.6,22.3,25.5,1013.9,35,5.8,184,15.7,8,,2015-01-12 6:34:32,2015-01-12 17:59:31,0.73,Partially cloudy,Partly cloudy throughout the day.,â›…,4.33E+10
Chennai,13/1/15,29.1,19.1,23.9,29.9,19.1,24.2,18.4,73.2,0,0,0,,0,0,31,16.6,10.1,1013.2,29.6,5.8,243.4,20.9,8,,2015-01-13 6:34:45,2015-01-13 18:00:05,0.75,Partially cloudy,Partly cloudy throughout the day.,â›…,"43279099999,remote"
Chennai,14/1/15,28.1,20.1,23.6,28.9,20.1,23.8,18.3,73.8,0,0,0,,0,0,32.4,18.4,36.3,1012.9,35,4.5,217.1,18.7,8,,2015-01-14 6:34:57,2015-01-14 18:00:38,0.8,Partially cloudy,Partly cloudy throughout the day.,â›…,4.33E+10
Chennai,15/1/15,29.1,19.1,24.2,30.9,19.1,24.7,19.5,76.6,0,0,0,,0,0,32,14.8,27.2,1012.9,38.9,5.1,199.3,17.1,8,,2015-01-15 6:35:07,2015-01-15 18:01:11,0.83,Partially cloudy,Partly cloudy throughout the day.,â›…,"43279099999,remote"
Chennai,16/1/15,29.1,22.1,25.2,30.9,22.1,25.9,21.4,80.9,0.1,100,4.17,rain,0,0,33.5,18.4,27.5,1013.3,38.3,4.4,191.9,16.4,7,,2015-01-16 6:35:17,2015-01-16 18:01:44,0.86,"Rain, Partially cloudy",Partly cloudy throughout the day with morning rain.,ğŸŒ§ï¸,"43279099999,remote"
Chennai,17/1/15,29.1,21.1,24.7,30.9,21.1,24.9,19.4,74.2,0,0,0,,0,0,32.8,18.4,37.2,1013.8,37.5,4.6,237.9,20.6,8,,2015-01-17 6:35:25,2015-01-17 18:02:16,0.89,Partially cloudy,Partly cloudy throughout the day.,â›…,4.33E+10
Chennai,18/1/15,29.1,20.1,24,30.4,20.1,24.3,19.2,75.9,0,0,0,,0,0,29.5,18.4,47.2,1014.5,35.9,4.8,242.4,21,9,,2015-01-18 6:35:33,2015-01-18 18:02:49,0.93,Partially cloudy,Partly cloudy throughout the day.,â›…,"43279099999,remote"
Chennai,19/1/15,29.1,20.1,24,30.4,20.1,24.2,18.6,73.8,0,0,0,,0,0,31.7,22.3,58.4,1014.3,29.7,4.5,236.9,20.6,8,,2015-01-19 6:35:39,2015-01-19 18:03:21,0.96,Partially cloudy,Partly cloudy throughout the day.,â›…,"43279099999,remote"
Chennai,20/1/15,29.1,20.1,24.1,30.4,20.1,24.4,18.8,74,0,0,0,,0,0,33.1,22.3,52.7,1015.7,33.8,4.9,246.2,21.2,9,,2015-01-20 6:35:44,2015-01-20 18:03:52,0,Partially cloudy,Partly cloudy throughout the day.,â›…,"43279099999,remote"
Chennai,21/1/15,29.1,20.1,24.2,29.5,20.1,24.2,17.9,70.5,0,0,0,,0,0,33.8,22.3,45.5,1017.1,35,5.8,250.3,21.7,9,,2015-01-21 6:35:48,2015-01-21 18:04:23,0.02,Partially cloudy,Partly cloudy throughout the day.,â›…,4.33E+10
Chennai,22/1/15,28.1,21.1,24.7,30.8,21.1,25.3,20.6,78.6,0,0,0,,0,0,30.2,22.3,41.3,1016.7,75,5,159.7,13.8,7,,2015-01-22 6:35:51,2015-01-22 18:04:54,0.06,Partially cloudy,Partly cloudy throughout the day.,â›…,4.33E+10
Chennai,23/1/15,29.1,23.1,25.7,32.1,23.1,26.6,22.3,82.3,0.5,100,4.17,rain,0,0,29.5,22.3,48,1014.3,60,5.5,169.3,14.6,7,,2015-01-23 6:35:53,2015-01-23 18:05:24,0.09,"Rain, Partially cloudy",Partly cloudy throughout the day with early morning rain.,ğŸŒ§ï¸,4.33E+10
Chennai,24/1/15,30.1,23.1,25.3,34.3,23.1,26.1,22.1,82.7,3,100,4.17,rain,0,0,30.2,24.1,45.2,1014.5,50.9,5.3,172.2,15,7,,2015-01-24 6:35:54,2015-01-24 18:05:54,0.13,"Rain, Partially cloudy",Partly cloudy throughout the day with morning rain.,ğŸŒ§ï¸,"43279099999,remote"
Chennai,25/1/15,29.1,20.1,24.9,30.9,20.1,25.4,20.2,76.5,0,0,0,,0,0,32.4,22.3,50.3,1015.8,39.2,6.3,224.7,19.5,8,,2015-01-25 6:35:54,2015-01-25 18:06:24,0.16,Partially cloudy,Partly cloudy throughout the day.,â›…,4.33E+10
Chennai,26/1/15,30.1,21.1,25.2,31.4,21.1,25.6,20,74.3,0,0,0,,0,0,29.2,20.5,64.6,1015.1,43.5,5.6,168.4,14.6,6,,2015-01-26 6:35:52,2015-01-26 18:06:52,0.2,Partially cloudy,Partly cloudy throughout the day.,â›…,"43279099999,remote"
Chennai,27/1/15,28.1,22.1,25.3,30.2,22.1,25.9,20.7,76.5,0,0,0,,0,0,36,24.1,45,1013.5,50.8,4.9,140,12,5,,2015-01-27 6:35:50,2015-01-27 18:07:21,0.25,Partially cloudy,Partly cloudy throughout the day.,â›…,4.33E+10
Chennai,28/1/15,29.1,21.1,25.3,30.9,21.1,25.9,20.4,75.2,0,0,0,,0,0,26.6,22.3,54.7,1012.3,44.2,4.9,152.1,13.3,5,,2015-01-28 6:35:46,2015-01-28 18:07:49,0.27,Partially cloudy,Partly cloudy throughout the day.,â›…,4.33E+10
Chennai,29/1/15,30.1,23.1,26.3,32.6,23.1,27.1,21.2,75,0,0,0,,0,0,31,22.3,64.8,1012.7,42.5,5.3,188.7,16.4,7,,2015-01-29 6:35:41,2015-01-29 18:08:16,0.3,Partially cloudy,Partly cloudy throughout the day.,â›…,4.33E+10
Chennai,30/1/15,30.1,23.1,25.9,32,23.1,26.5,21,75.6,0,0,0,,0,0,30.2,22.3,60.3,1014.4,43.3,6,222.2,19.3,8,,2015-01-30 6:35:36,2015-01-30 18:08:43,0.34,Partially cloudy,Partly cloudy throughout the day.,â›…,4.33E+10
Chennai,31/1/15,29.1,21.1,25.4,30.9,21.1,26,20.6,76.2,0,0,0,,0,0,32.4,24.1,41.2,1014.8,38.3,5,240.9,20.9,9,,2015-01-31 6:35:29,2015-01-31 18:09:09,0.37,Partially cloudy,Partly cloudy throughout the day.,â›…,4.33E+10
Chennai,01/2/15,30.1,21.1,25.4,33.4,21.1,26.2,21,77.9,0,0,0,,0,0,31,22.3,60.8,1014.5,39.2,4.8,198.9,17.2,6,,2015-02-01 6:35:21,2015-02-01 18:09:35,0.41,Partially cloudy,Partly cloudy throughout the day.,â›…,4.33E+10
Chennai,02/2/15,30.1,22.1,25.8,31.4,22.1,26.4,20.2,72.7,0,0,0,,0,0,36.4,18.4,63.4,1015.8,37.5,5,234.5,20.3,8,,2015-02-02 6:35:12,2015-02-02 18:10:00,0.44,Partially cloudy,Partly cloudy throughout the day.,â›…,4.33E+10
Chennai,03/2/15,29.1,21.1,25.4,30.9,21.1,25.9,19.7,71.6,0,0,0,,0,0,37.8,22.3,30.2,1017.2,43.3,5.7,213.2,18.3,8,,2015-02-03 6:35:01,2015-02-03 18:10:25,0.48,Partially cloudy,Partly cloudy throughout the day.,â›…,4.33E+10
Chennai,04/2/15,30.1,22.1,25.3,32,22.1,25.9,20.8,77.1,0,0,0,,0,0,37.4,22.3,17.5,1016.6,47.5,5,220.8,19.2,8,,2015-02-04 6:34:50,2015-02-04 18:10:49,0.5,Partially cloudy,Partly cloudy throughout the day.,â›…,4.33E+10
Chennai,05/2/15,31.1,21.1,25.8,31.9,21.1,26.3,20.2,73.3,0,0,0,,0,0,33.8,22.3,47.8,1015,51.7,5,240.8,20.9,9,,2015-02-05 6:34:38,2015-02-05 18:11:12,0.54,Partially cloudy,Partly cloudy throughout the day.,â›…,4.33E+10
Chennai,06/2/15,30.1,22.1,26.1,32,22.1,26.9,20.8,73.8,0,0,0,,0,0,28.4,22.3,51.3,1014.5,71.7,5.5,233.8,20.1,8,,2015-02-06 6:34:25,2015-02-06 18:11:35,0.58,Partially cloudy,Partly cloudy throughout the day.,â›…,4.33E+10
Chennai,07/2/15,31.1,22.1,26.1,32,22.1,26.4,19.9,71.3,0,0,0,,0,0,30.6,22.3,63.2,1014.1,33.3,6,245.9,21.3,9,,2015-02-07 6:34:10,2015-02-07 18:11:57,0.61,Partially cloudy,Partly cloudy throughout the day.,â›…,4.33E+10
Chennai,08/2/15,31.1,21.1,25.5,32.5,21.1,25.9,19.9,73.2,0,0,0,,0,0,32,22.3,68.2,1013.8,30.3,4.8,244.8,21.2,9,,2015-02-08 6:33:55,2015-02-08 18:12:19,0.64,Partially cloudy,Partly cloudy throughout the day.,â›…,"43279099999,remote"
Chennai,09/2/15,30.1,22.1,25.5,31.4,22.1,25.9,19.2,69.4,0,0,0,,0,0,33.5,24.1,60.2,1013.8,38.4,5.7,222.5,19.3,9,,2015-02-09 6:33:39,2015-02-09 18:12:40,0.68,Partially cloudy,Partly cloudy throughout the day.,â›…,"43279099999,remote"
Chennai,10/2/15,29.1,22.1,24.8,30.9,22.1,25.3,19.7,73.9,0,0,0,,0,0,35.6,22.3,36.1,1014.4,59.2,5.1,180.1,15.6,7,,2015-02-10 6:33:21,2015-02-10 18:13:00,0.71,Partially cloudy,Partly cloudy throughout the day.,â›…,4.33E+10
Chennai,11/2/15,30.1,22.1,25.6,33.4,22.1,26.6,21.1,77,0,0,0,,0,0,34.2,25.9,39,1013.4,45,5.4,196.1,17,7,,2015-02-11 6:33:03,2015-02-11 18:13:20,0.74,Partially cloudy,Partly cloudy throughout the day.,â›…,4.33E+10
Chennai,12/2/15,31.1,22.1,26.3,33.1,22.1,27,21.4,76.3,0,0,0,,0,0,34.6,22.3,44,1012.8,37.5,4.9,226.1,19.6,8,,2015-02-12 6:32:44,2015-02-12 18:13:39,0.75,Partially cloudy,Partly cloudy throughout the day.,â›…,4.33E+10
Chennai,13/2/15,31.1,23.1,26.5,34.7,23.1,27.6,22,77.4,0,0,0,,0,0,27.4,20.5,88.5,1012.5,36.7,4.4,256.5,22.1,9,,2015-02-13 6:32:23,2015-02-13 18:13:58,0.81,Partially cloudy,Partly cloudy throughout the day.,â›…,"43279099999,remote"
Chennai,14/2/15,32.1,21.1,26.3,35,21.1,27,20.8,74.6,0,0,0,,0,0,29.9,22.3,155.5,1011.5,32.1,4.7,269.9,23.3,9,,2015-02-14 6:32:02,2015-02-14 18:14:16,0.84,Partially cloudy,Partly cloudy throughout the day.,â›…,"43279099999,remote"
Chennai,15/2/15,34.1,22.1,26.8,34.6,22.1,27.1,19.9,69.7,0,0,0,,0,0,23.8,22.3,156.5,1011.5,15,5.7,267.9,23.1,9,,2015-02-15 6:31:40,2015-02-15 18:14:33,0.88,Clear,Clear conditions throughout the day.,â˜€ï¸,4.33E+10
Chennai,16/2/15,33.1,22.1,26.6,34.1,22.1,27.2,20.5,72.2,0,0,0,,0,0,26.3,18.4,124.1,1012.7,25.8,5.4,258.3,22.4,9,,2015-02-16 6:31:17,2015-02-16 18:14:50,0.91,Partially cloudy,Partly cloudy throughout the day.,â›…,4.33E+10
Chennai,17/2/15,32.1,21.1,26,34.3,21.1,26.9,20.9,75.2,0,0,0,,0,0,27,18.4,130.6,1012.4,32.5,5.3,256,22,9,,2015-02-17 6:30:53,2015-02-17 18:15:07,0.94,Partially cloudy,Partly cloudy throughout the day.,â›…,4.33E+10
Chennai,18/2/15,32.1,21.1,26.2,32.6,21.1,26.5,19.8,70.9,0,0,0,,0,0,34.2,16.6,170.4,1011.8,25.8,5.3,270,23.4,9,,2015-02-18 6:30:29,2015-02-18 18:15:22,0.98,Partially cloudy,Partly cloudy throughout the day.,â›…,4.33E+10
Chennai,19/2/15,31.1,21.1,25.8,33.1,21.1,26.3,20.2,72.7,0,0,0,,0,0,31,18.4,157.2,1011.7,22.5,5.8,277.8,23.8,9,,2015-02-19 6:30:03,2015-02-19 18:15:37,0,Partially cloudy,Partly cloudy throughout the day.,â›…,4.33E+10
Chennai,20/2/15,31.1,21.1,25.7,32.6,21.1,26.3,20.3,73.7,0,0,0,,0,0,28.4,22.3,84,1012.5,24.6,5.4,269.5,23.2,9,,2015-02-20 6:29:37,2015-02-20 18:15:52,0.04,Partially cloudy,Partly cloudy throughout the day.,â›…,4.33E+10
Chennai,21/2/15,31.1,22.1,26.1,31.9,22.1,26.7,20.3,72.5,0,0,0,,0,0,26.6,18.4,71.5,1012.8,30,5.8,271.6,23.5,9,,2015-02-21 6:29:10,2015-02-21 18:16:06,0.08,Partially cloudy,Partly cloudy throughout the day.,â›…,4.33E+10
Chennai,22/2/15,32.1,22.1,26.3,32.5,22.1,26.5,19.8,70.8,0,0,0,,0,0,29.9,18.4,67.2,1013,19.2,5.2,276.1,23.8,10,,2015-02-22 6:28:42,2015-02-22 18:16:19,0.11,Clear,Clear conditions throughout the day.,â˜€ï¸,4.33E+10
Chennai,23/2/15,31.1,21.1,26.1,31.9,21.1,26.6,19.9,71,0,0,0,,0,0,24.5,18.4,84.1,1013.3,17.5,5.6,274.9,23.8,10,,2015-02-23 6:28:13,2015-02-23 18:16:32,0.14,Clear,Clear conditions throughout the day.,â˜€ï¸,4.33E+10
Chennai,24/2/15,33.1,21.1,25.9,33.5,21.1,26.2,19.5,71.6,0,0,0,,0,0,25.2,18.4,95.2,1012.4,30.4,4.9,283.5,24.5,10,,2015-02-24 6:27:44,2015-02-24 18:16:45,0.18,Partially cloudy,Partly cloudy throughout the day.,â›…,4.33E+10
Chennai,25/2/15,32.1,20.1,25.6,31.9,20.1,25.6,18.4,69.9,0,0,0,,0,0,24.8,20.5,106.3,1010.9,32.9,5.8,277.6,24,10,,2015-02-25 6:27:14,2015-02-25 18:16:57,0.25,Partially cloudy,Clearing in the afternoon.,â›…,"43279099999,remote"
Chennai,26/2/15,31.1,21.1,26.4,34.3,21.1,28.2,21.5,75.6,0,0,0,,0,0,30.6,18.4,113.1,1009.6,42.5,6.1,258.9,22.3,9,,2015-02-26 6:26:43,2015-02-26 18:17:08,0.25,Partially cloudy,Partly cloudy throughout the day.,â›…,4.33E+10
Chennai,27/2/15,31.1,24.1,27.8,36.7,24.1,30.9,23.8,79.4,0,0,0,,0,0,32.8,24.1,123.5,1009.9,46.7,5.7,210.7,18.2,8,,2015-02-27 6:26:12,2015-02-27 18:17:19,0.28,Partially cloudy,Partly cloudy throughout the day.,â›…,4.33E+10
Chennai,28/2/15,31.1,26.1,28,36.7,26.1,31.1,23.9,78.7,0,0,0,,0,0,37.8,27.7,122.3,1010.2,44.9,6.1,194.8,16.9,7,,2015-02-28 6:25:40,2015-02-28 18:17:30,0.31,Partially cloudy,Partly cloudy throughout the day.,â›…,"43279099999,remote"
Chennai,01/3/15,31.1,26.1,28.4,35.6,26.1,31.7,23.3,74.2,0,0,0,,0,0,37.8,25.9,131.7,1010.5,46.7,6.1,215.5,18.6,8,,2015-03-01 6:25:07,2015-03-01 18:17:40,0.35,Partially cloudy,Partly cloudy throughout the day.,â›…,4.33E+10
Chennai,02/3/15,31.1,26.1,28.5,35.6,26.1,31.9,23.5,75.1,0,0,0,,0,0,31.7,25.9,128.3,1011.7,50.8,6.4,209.9,18.2,8,,2015-03-02 6:24:34,2015-03-02 18:17:49,0.38,Partially cloudy,Partly cloudy throughout the day.,â›…,4.33E+10
Chennai,03/3/15,32.1,25.1,28.3,36.9,25.1,31.2,23.3,75.4,0,0,0,,0,0,27.7,20.5,130,1011,37.8,6.1,231.8,19.9,9,,2015-03-03 6:24:00,2015-03-03 18:17:58,0.42,Partially cloudy,Partly cloudy throughout the day.,â›…,"43279099999,remote"
Chennai,04/3/15,33.1,24.1,28.9,38.2,24.1,32,23.2,72.9,0,0,0,,0,0,32.4,25.9,154.2,1010.5,38.3,6.3,239.2,20.6,9,,2015-03-04 6:23:26,2015-03-04 18:18:07,0.45,Partially cloudy,Partly cloudy throughout the day.,â›…,4.33E+10
Chennai,05/3/15,33.1,25.1,29.1,40.7,25.1,33.9,25,79,0,0,0,,0,0,32.4,22.3,124.2,1011.6,44.2,6.1,236.2,20.4,9,,2015-03-05 6:22:51,2015-03-05 18:18:16,0.5,Partially cloudy,Partly cloudy throughout the day.,â›…,4.33E+10
Chennai,06/3/15,32.1,25.1,29,36.9,25.1,32.9,24.1,76.1,0,0,0,,0,0,30.2,20.5,97.1,1012.7,36.7,7.1,217.9,18.8,9,,2015-03-06 6:22:16,2015-03-06 18:18:24,0.52,Partially cloudy,Partly cloudy throughout the day.,â›…,4.33E+10
Chennai,07/3/15,32.1,25.1,28.6,36.9,25.1,31.4,23.4,74.8,0,0,0,,0,0,32.8,24.1,102.8,1012.5,40.8,6.5,235,20.3,9,,2015-03-07 6:21:40,2015-03-07 18:18:31,0.55,Partially cloudy,Partly cloudy throughout the day.,â›…,4.33E+10
Chennai,08/3/15,32.1,24.1,28.4,36.9,24.1,31.3,23.1,74,0,0,0,,0,0,32,22.3,121.6,1013.2,41.7,5.9,236.1,20.4,9,,2015-03-08 6:21:04,2015-03-08 18:18:39,0.59,Partially cloudy,Partly cloudy throughout the day.,â›…,4.33E+10
Chennai,09/3/15,33.1,25.1,28.3,37.1,25.1,30.5,23,74.7,0,0,0,,0,0,29.9,22.3,81.6,1014.2,36.7,5.4,261.4,22.5,9,,2015-03-09 6:20:27,2015-03-09 18:18:45,0.62,Partially cloudy,Partly cloudy throughout the day.,â›…,4.33E+10
Chennai,10/3/15,32.1,23.1,27.3,33.6,23.1,28,20.9,70.8,0,0,0,,0,0,31.3,22.3,50.8,1014.1,35.8,5.1,263.9,22.9,9,,2015-03-10 6:19:50,2015-03-10 18:18:52,0.65,Partially cloudy,Partly cloudy throughout the day.,â›…,4.33E+10
Chennai,11/3/15,32.1,23.1,27.4,35,23.1,28.8,21,69.4,0,0,0,,0,0,32.8,22.3,61.5,1013.6,33.3,6,252.5,21.8,9,,2015-03-11 6:19:13,2015-03-11 18:18:58,0.69,Partially cloudy,Partly cloudy throughout the day.,â›…,4.33E+10
Chennai,12/3/15,33.1,25.1,28.3,38.2,25.1,30.6,22.6,72,0,0,0,,0,0,33.8,24.1,58.9,1013.6,38.8,6,242.4,21,8,,2015-03-12 6:18:35,2015-03-12 18:19:05,0.72,Partially cloudy,Partly cloudy throughout the day.,â›…,"43279099999,remote"
Chennai,13/3/15,32.1,25.1,28.4,35.9,25.1,30.5,22.7,73,0,0,0,,0,0,30.2,16.6,70.9,1013.2,35.8,6.3,270.6,23.4,9,,2015-03-13 6:17:57,2015-03-13 18:19:10,0.75,Partially cloudy,Partly cloudy throughout the day.,â›…,4.33E+10
Chennai,14/3/15,33.1,24.1,28.6,37.1,24.1,31.1,22.9,73,0,0,0,,0,0,33.1,24.1,116.7,1014,34.2,5.8,280,24.3,10,,2015-03-14 6:17:19,2015-03-14 18:19:16,0.79,Partially cloudy,Partly cloudy throughout the day.,â›…,4.33E+10
Chennai,15/3/15,33.1,25.1,28.5,38.2,25.1,31.5,23.5,75.5,0,0,0,,0,0,33.8,22.3,107.7,1014,38.3,6.7,228.7,19.8,8,,2015-03-15 6:16:40,2015-03-15 18:19:21,0.82,Partially cloudy,Partly cloudy throughout the day.,â›…,4.33E+10
Chennai,16/3/15,32.1,24.1,28.3,36.9,24.1,30.8,22.9,73.4,0,0,0,,0,0,32,20.5,135.3,1013.9,31.1,6.5,276.7,23.9,9,,2015-03-16 6:16:01,2015-03-16 18:19:26,0.86,Partially cloudy,Partly cloudy throughout the day.,â›…,4.33E+10
Chennai,17/3/15,33.1,23.1,27.7,35,23.1,29.2,22,73.5,0,0,0,,0,0,29.9,20.5,120.6,1012.7,33,5.4,286.2,24.7,10,,2015-03-17 6:15:22,2015-03-17 18:19:31,0.89,Partially cloudy,Partly cloudy throughout the day.,â›…,"43279099999,remote"
Chennai,18/3/15,35.1,22.1,28.7,39.5,22.1,30.6,21.8,69.2,0,0,0,,0,0,29.2,18.4,151.7,1010.5,22.5,5.8,288.7,24.8,10,,2015-03-18 6:14:43,2015-03-18 18:19:36,0.93,Partially cloudy,Partly cloudy throughout the day.,â›…,4.33E+10
Chennai,19/3/15,34.1,23.1,28.4,38.4,23.1,30.7,22.6,73,0,0,0,,0,0,30.2,20.5,121.8,1011.1,18.8,6.2,291.8,25.3,10,,2015-03-19 6:14:03,2015-03-19 18:19:40,0.96,Clear,Clear conditions throughout the day.,â˜€ï¸,4.33E+10
Chennai,20/3/15,33.1,24.1,28.2,37.1,24.1,30.6,23,75.1,0,0,0,,0,0,28.4,18.4,108.5,1012.3,24.5,5.6,288.4,24.9,10,,2015-03-20 6:13:23,2015-03-20 18:19:45,0,Partially cloudy,Partly cloudy throughout the day.,â›…,"43279099999,remote"
Chennai,21/3/15,36.1,24.1,29.1,37.8,24.1,30.6,21.2,67.3,0,0,0,,0,0,26.3,18.4,123.9,1012.9,11.7,5.5,300.1,25.9,10,,2015-03-21 6:12:44,2015-03-21 18:19:49,0.03,Clear,Clear conditions throughout the day.,â˜€ï¸,4.33E+10
Chennai,22/3/15,36.1,24.1,29.6,40.9,24.1,32.4,22.5,68.7,0,0,0,,0,0,30.2,22.3,165.3,1011.5,6.3,5.3,300.6,26,10,,2015-03-22 6:12:04,2015-03-22 18:19:53,0.06,Clear,Clear conditions throughout the day.,â˜€ï¸,4.33E+10
Chennai,23/3/15,35.1,25.1,29.4,43.5,25.1,33.4,24.4,76.2,0,0,0,,0,0,33.8,22.3,154.3,1009.9,3.8,5.3,294.7,25.5,10,,2015-03-23 6:11:24,2015-03-23 18:19:57,0.1,Clear,Clear conditions throughout the day.,â˜€ï¸,4.33E+10
Chennai,24/3/15,34.1,25.1,29.4,42.1,25.1,33.4,24.5,76.9,0,0,0,,0,0,36.7,22.3,161.1,1009.5,1.3,5,283.4,24.7,10,,2015-03-24 6:10:44,2015-03-24 18:20:01,0.13,Clear,Clear conditions throughout the day.,â˜€ï¸,4.33E+10
Chennai,25/3/15,33.1,25.1,28.8,39.4,25.1,32.3,23.9,75.9,0,0,0,,0,0,36.4,22.3,142.5,1010.6,22.8,5.5,276.6,23.9,9,,2015-03-25 6:10:03,2015-03-25 18:20:05,0.16,Partially cloudy,Partly cloudy throughout the day.,â›…,"43279099999,remote"
Chennai,26/3/15,33.1,25.1,28.8,37.1,25.1,31.8,23.3,73.5,0,0,0,,0,0,29.5,18.4,103.2,1012.5,30.4,5.5,273.7,23.8,9,,2015-03-26 6:09:23,2015-03-26 18:20:09,0.19,Partially cloudy,Partly cloudy throughout the day.,â›…,4.33E+10
Chennai,27/3/15,33.1,25.1,29.1,37.1,25.1,32.2,23.1,71.3,0,0,0,,0,0,28.4,22.3,89.6,1012.9,35,6.3,283.3,24.5,9,,2015-03-27 6:08:43,2015-03-27 18:20:13,0.25,Partially cloudy,Partly cloudy throughout the day.,â›…,"43279099999,remote"
Chennai,28/3/15,34.1,25.1,29.5,39.5,25.1,33.6,24.1,74,0,0,0,,0,0,32.8,22.3,111.9,1011.6,32.4,5.9,287.9,24.8,10,,2015-03-28 6:08:03,2015-03-28 18:20:17,0.26,Partially cloudy,Partly cloudy throughout the day.,â›…,"43279099999,remote"
Chennai,29/3/15,34.1,26.1,29.7,38.4,26.1,33.3,23.6,71.4,0,0,0,,0,0,31.3,22.3,124.9,1010.1,34.2,6.6,291.7,25.3,10,,2015-03-29 6:07:23,2015-03-29 18:20:21,0.29,Partially cloudy,Partly cloudy throughout the day.,â›…,4.33E+10
Chennai,30/3/15,34.1,26.1,29.9,40.7,26.1,34.1,24.1,72.4,0,0,0,,0,0,32.4,24.1,130.3,1009.8,38.3,6.6,270.5,23.6,9,,2015-03-30 6:06:43,2015-03-30 18:20:24,0.33,Partially cloudy,Partly cloudy throughout the day.,â›…,4.33E+10
Chennai,31/3/15,34.1,27.1,30.3,40.7,30.8,36,24.8,73.5,0,0,0,,0,0,34.6,22.3,125.8,1010.1,40,6.5,248.5,21.4,9,,2015-03-31 6:06:04,2015-03-31 18:20:28,0.36,Partially cloudy,Partly cloudy throughout the day.,â›…,4.33E+10
Chennai,01/4/15,34.1,27.1,30.1,42.1,30.8,36,25.1,75.9,0,0,0,,0,0,37.1,22.3,134.3,1009.9,38.3,6.8,242.4,21,8,,2015-04-01 6:05:24,2015-04-01 18:20:32,0.39,Partially cloudy,Partly cloudy throughout the day.,â›…,4.33E+10
Chennai,02/4/15,35.1,27.1,30.6,43.5,30.8,36.5,25,73.5,0,0,0,,0,0,35.3,22.3,174,1008.6,32.5,6.9,263.8,22.9,9,,2015-04-02 6:04:44,2015-04-02 18:20:36,0.43,Partially cloudy,Partly cloudy throughout the day.,â›…,4.33E+10
Chennai,03/4/15,37.1,27.1,31.2,46.4,30.8,38.1,25.5,73.5,0,0,0,,0,0,35.6,22.3,176.8,1006.3,31.3,6.7,290.5,25,10,,2015-04-03 6:04:05,2015-04-03 18:20:40,0.46,Partially cloudy,Partly cloudy throughout the day.,â›…,4.33E+10
Chennai,04/4/15,38.1,28.1,31.7,44.8,32.8,38.5,25.1,70.3,0,0,0,,0,0,37.1,25.9,175.3,1004.5,29.6,6.9,280.1,24.3,10,,2015-04-04 6:03:26,2015-04-04 18:20:45,0.5,Partially cloudy,Partly cloudy throughout the day.,â›…,4.33E+10
Chennai,05/4/15,36.1,28.1,31.2,45.1,33.7,38.6,25.8,74.6,0,0,0,,0,0,38.5,24.1,164.9,1005.8,35.4,6.7,281.8,24.2,10,,2015-04-05 6:02:47,2015-04-05 18:20:49,0.53,Partially cloudy,Partly cloudy throughout the day.,â›…,4.33E+10
Chennai,06/4/15,35.1,28.1,30.9,42,32.8,36.6,24.7,71.3,0,0,0,,0,0,40.7,22.3,159.8,1006.7,35,7,276.4,23.9,10,,2015-04-06 6:02:08,2015-04-06 18:20:53,0.56,Partially cloudy,Partly cloudy throughout the day.,â›…,4.33E+10
Chennai,07/4/15,35.1,28.1,30.6,45.1,32.8,37.3,25.5,75.2,0,0,0,,0,0,38.9,22.3,153.5,1007.5,36.7,6.8,278.2,24.1,10,,2015-04-07 6:01:30,2015-04-07 18:20:58,0.6,Partially cloudy,Partly cloudy throughout the day.,â›…,4.33E+10
Chennai,08/4/15,35.1,28.1,30.6,42.1,32.8,37.2,25.3,73.9,0,0,0,,0,0,38.2,22.3,145.2,1009.3,38.3,6.8,261.4,22.6,8,,2015-04-08 6:00:51,2015-04-08 18:21:02,0.63,Partially cloudy,Partly cloudy throughout the day.,â›…,4.33E+10
Chennai,09/4/15,34.1,28.1,30.7,42.1,33.7,37.5,25.4,74.2,0.2,100,4.17,rain,0,0,36.4,22.3,127.6,1009.7,40.9,7.2,247,21.3,9,,2015-04-09 6:00:14,2015-04-09 18:21:07,0.67,"Rain, Partially cloudy",Partly cloudy throughout the day with morning rain.,ğŸŒ§ï¸,"43279099999,remote"
Chennai,10/4/15,34.1,27.1,30.4,40.7,30.8,35.8,24.6,72.7,0,0,0,,0,0,34.9,24.1,150,1010.2,31.3,7.3,286.2,24.8,10,,2015-04-10 5:59:36,2015-04-10 18:21:12,0.7,Partially cloudy,Partly cloudy throughout the day.,â›…,4.33E+10
Chennai,11/4/15,35.1,26.1,30.4,42,26.1,35.3,24.4,71.9,0,0,0,,0,0,37.1,22.3,155.4,1010.3,35,6.5,284.8,24.5,10,,2015-04-11 5:58:59,2015-04-11 18:21:18,0.74,Partially cloudy,Partly cloudy throughout the day.,â›…,4.33E+10
Chennai,12/4/15,33.1,26.1,30.1,39.4,26.1,34.6,24.1,71.6,0,0,0,,0,0,36,22.3,132.3,1011.9,43.3,6.6,268.3,23.2,9,,2015-04-12 5:58:22,2015-04-12 18:21:23,0.75,Partially cloudy,Partly cloudy throughout the day.,â›…,4.33E+10
Chennai,13/4/15,33.1,25.1,29,38.2,25.1,32.2,23.2,72.2,0.9,100,8.33,rain,0,0,28.4,22.3,149.4,1012,55.4,5.6,145.2,12.6,7,,2015-04-13 5:57:45,2015-04-13 18:21:29,0.81,"Rain, Partially cloudy",Partly cloudy throughout the day with rain.,ğŸŒ§ï¸,"43279099999,remote"
Chennai,14/4/15,34.1,23.1,28.5,36.6,23.1,30.5,21.4,68.1,0,0,0,,0,0,32,24.1,95.8,1010.2,53.3,6.8,286,24.6,10,,2015-04-14 5:57:09,2015-04-14 18:21:34,0.84,Partially cloudy,Partly cloudy throughout the day.,â›…,"43279099999,remote"
Chennai,15/4/15,29.1,25.1,27.2,34.7,25.1,29.5,23.9,82.8,106,100,8.33,rain,0,0,32,18.4,73.3,1010.8,64.6,5.6,176.6,15.3,7,,2015-04-15 5:56:34,2015-04-15 18:21:40,0.88,"Rain, Partially cloudy",Partly cloudy throughout the day with rain.,ğŸŒ§ï¸,"43279099999,remote"
Chennai,16/4/15,33.1,25.1,28.7,39.4,25.1,32.1,24.1,77.5,0.1,100,4.17,rain,0,0,27.4,18.4,73.7,1011.5,42.6,5.7,233.7,20.3,9,,2015-04-16 5:55:59,2015-04-16 18:21:47,0.91,"Rain, Partially cloudy",Partly cloudy throughout the day with early morning rain.,ğŸŒ§ï¸,"43279099999,remote"
Chennai,17/4/15,33.1,26.1,29.5,40.7,26.1,34,24.6,76.5,0,0,0,,0,0,28.4,22.3,63,1009.7,40.6,6.1,249.2,21.4,9,,2015-04-17 5:55:24,2015-04-17 18:21:53,0.95,Partially cloudy,Partly cloudy throughout the day.,â›…,"43279099999,remote"
Chennai,18/4/15,35.1,25.1,29.3,39.6,25.1,32.5,23.1,71.1,0,0,0,,0,0,25.9,22.3,85.3,1007.8,33.3,7.3,285.3,24.8,10,,2015-04-18 5:54:50,2015-04-18 18:22:00,0.98,Partially cloudy,Partly cloudy throughout the day.,â›…,"43279099999,remote"
Chennai,19/4/15,33.1,26.1,30,40.7,26.1,35,24.7,74.3,0,0,0,,0,0,28.8,18.4,137.5,1008,30,7.4,281.7,24.3,9,,2015-04-19 5:54:16,2015-04-19 18:22:07,0,Partially cloudy,Partly cloudy throughout the day.,â›…,"43279099999,remote"
Chennai,20/4/15,34.1,27.1,30.6,40.7,30.8,36.5,24.9,72.5,0,0,0,,0,0,26.3,22.3,110.6,1009.5,35,7.5,238.3,20.6,9,,2015-04-20 5:53:43,2015-04-20 18:22:15,0.05,Partially cloudy,Partly cloudy throughout the day.,â›…,4.33E+10
Chennai,21/4/15,34.1,28.1,30.9,42.1,33.7,38.2,25.7,74.1,0.2,100,4.17,rain,0,0,34.2,24.1,140.1,1009.5,47.1,6.9,229.6,20,8,,2015-04-21 5:53:10,2015-04-21 18:22:22,0.08,"Rain, Partially cloudy",Partly cloudy throughout the day with morning rain.,ğŸŒ§ï¸,"43279099999,remote"
Chennai,22/4/15,35.1,28,31.1,43.5,33.1,37.9,25.3,72.5,0,0,0,,0,0,37.8,22.3,178.4,1008.5,38.4,6.7,284.4,24.5,9,,2015-04-22 5:52:38,2015-04-22 18:22:30,0.11,Partially cloudy,Partly cloudy throughout the day.,â›…,"43279099999,remote"
Chennai,23/4/15,36.1,29.1,31.6,44.8,35.8,39.8,26.1,73.3,0,0,0,,0,0,40.3,27.7,178.9,1008.2,30.9,6.5,289.3,25.2,10,,2015-04-23 5:52:07,2015-04-23 18:22:39,0.15,Partially cloudy,Partly cloudy throughout the day.,â›…,"43279099999,remote"
Chennai,24/4/15,35.1,24.1,31,43.5,24.1,37.5,25.1,71.7,5,100,4.17,rain,0,0,33.5,18.4,172.2,1009,59,6.3,270,23.2,9,,2015-04-24 5:51:36,2015-04-24 18:22:47,0.18,"Rain, Partially cloudy",Partly cloudy throughout the day with late afternoon rain.,ğŸŒ§ï¸,"VOMM,43279099999,remote"
Chennai,25/4/15,35.1,24.1,29.1,42.1,24.1,32.3,23,71.5,3.1,100,8.33,rain,0,0,37.1,22.3,186.2,1008.4,64.9,6.3,242.6,20.7,9,,2015-04-25 5:51:05,2015-04-25 18:22:56,0.21,"Rain, Partially cloudy",Partly cloudy throughout the day with rain clearing later.,ğŸŒ§ï¸,"43279099999,remote"
Chennai,26/4/15,35.1,28.1,30.9,42.1,33.7,37.4,25.1,72.5,0,0,0,,0,0,31.7,22.3,155.8,1009,56.7,7.1,263.4,22.9,9,,2015-04-26 5:50:36,2015-04-26 18:23:06,0.25,Partially cloudy,Partly cloudy throughout the day.,â›…,4.33E+10
Chennai,27/4/15,34.1,27.1,30.6,42.1,31.4,37.2,25.4,74.7,0,0,0,,0,0,34.9,24.1,167.1,1010,36.7,7.2,245.9,21.3,8,,2015-04-27 5:50:07,2015-04-27 18:23:15,0.28,Partially cloudy,Partly cloudy throughout the day.,â›…,4.33E+10
Chennai,28/4/15,35.1,26.1,30.7,42.1,26.1,36.4,24.9,72.3,0,0,0,,0,0,37.1,20.5,181.9,1009.3,28.8,7.2,295.8,25.7,10,,2015-04-28 5:49:38,2015-04-28 18:23:25,0.31,Partially cloudy,Partly cloudy throughout the day.,â›…,4.33E+10
Chennai,29/4/15,36.1,28.1,31.2,44.8,33.7,38.6,25.8,74.1,0,0,0,,0,0,40,24.1,174.9,1008.5,35.8,6.3,281.5,24.3,10,,2015-04-29 5:49:11,2015-04-29 18:23:35,0.34,Partially cloudy,Partly cloudy throughout the day.,â›…,4.33E+10
Chennai,30/4/15,37.1,28.1,31.6,46.9,33.7,39.8,26.1,73.9,0,0,0,,0,0,42.5,24.1,183.4,1008.5,34.2,6.4,300.2,26,10,,2015-04-30 5:48:44,2015-04-30 18:23:46,0.37,Partially cloudy,Partly cloudy throughout the day.,â›…,4.33E+10
Chennai,01/5/15,37.1,29.1,32.1,49.6,35.8,41.3,26.6,73.4,0,0,0,,0,0,41,22.3,173.2,1007.6,30,6.7,297.8,25.8,10,,2015-05-01 5:48:17,2015-05-01 18:23:57,0.41,Partially cloudy,Partly cloudy throughout the day.,â›…,4.33E+10
Chennai,02/5/15,38.1,29.1,32.3,48.3,35.8,40.9,26.1,71.1,0,0,0,,0,0,43.2,22.3,179,1007.3,37.1,6.2,298.3,25.8,10,,2015-05-02 5:47:52,2015-05-02 18:24:08,0.44,Partially cloudy,Partly cloudy throughout the day.,â›…,4.33E+10
Chennai,03/5/15,36.1,25.1,31.3,46.9,25.1,38.6,25.5,72.3,0,0,0,,0,0,39.6,20.5,163,1007.7,37.2,5.9,292.7,25.2,9,,2015-05-03 5:47:27,2015-05-03 18:24:20,0.47,Partially cloudy,Partly cloudy throughout the day.,â›…,"43279099999,remote"
Chennai,04/5/15,34.1,29.1,31.4,43.7,36.3,39.7,26.2,74.5,0,0,0,,0,0,37.8,20.5,146.6,1008.3,44.2,5.9,260.4,22.7,9,,2015-05-04 5:47:03,2015-05-04 18:24:32,0.5,Partially cloudy,Partly cloudy throughout the day.,â›…,4.33E+10
Chennai,05/5/15,35.1,28.1,31.1,42,33.7,37.8,25.3,72.6,0,0,0,,0,0,30.2,18.4,132.4,1008,40,6.3,252.3,22,8,,2015-05-05 5:46:40,2015-05-05 18:24:44,0.54,Partially cloudy,Partly cloudy throughout the day.,â›…,4.33E+10
Chennai,06/5/15,35.1,27.1,31.1,43.5,31.4,38,25.4,72.6,0,0,0,,0,0,33.8,22.3,146.3,1007,40.8,6.5,252.3,21.9,9,,2015-05-06 5:46:17,2015-05-06 18:24:56,0.58,Partially cloudy,Partly cloudy throughout the day.,â›…,4.33E+10
Chennai,07/5/15,36.1,28.1,31.5,44.8,33.7,38.9,25.6,72.3,0,0,0,,0,0,32.4,25.9,159.1,1007.8,38.3,6.6,272.5,23.5,9,,2015-05-07 5:45:55,2015-05-07 18:25:09,0.61,Partially cloudy,Partly cloudy throughout the day.,â›…,4.33E+10
Chennai,08/5/15,36.1,28.1,31.8,46.4,33.7,39.6,25.8,71.8,0,0,0,,0,0,40,25.9,173.9,1006.6,30.8,6.2,287.9,24.8,9,,2015-05-08 5:45:34,2015-05-08 18:25:23,0.65,Partially cloudy,Partly cloudy throughout the day.,â›…,4.33E+10
Chennai,09/5/15,36.1,29.1,32,44.8,35.8,40,25.9,71.3,0,0,0,,0,0,38.5,18.4,167.8,1005.3,27.9,6.3,277,24.1,9,,2015-05-09 5:45:14,2015-05-09 18:25:36,0.68,Partially cloudy,Partly cloudy throughout the day.,â›…,4.33E+10
Chennai,10/5/15,35.1,29.7,31.9,43.5,37.5,40.6,26.3,73.3,0,0,0,,0,0,32.8,16.6,150.2,1005.7,46.1,6.8,220.1,18.9,7,,2015-05-10 5:44:55,2015-05-10 18:25:50,0.72,Partially cloudy,Partly cloudy throughout the day.,â›…,"43279099999,remote"
Chennai,11/5/15,34.1,30.1,31.2,42.5,35.2,39.5,26.1,74.6,0,0,0,,0,0,28.4,18.4,163.1,1007.4,75,6,120,10.5,6,,2015-05-11 5:44:36,2015-05-11 18:26:04,0.75,Partially cloudy,Partly cloudy throughout the day.,â›…,4.33E+10
Chennai,12/5/15,35.1,29.1,31.5,45.1,35.8,39.5,25.9,72.6,0,0,0,,0,0,29.5,22.3,124.4,1007.3,73.7,7,263.4,22.9,9,,2015-05-12 5:44:18,2015-05-12 18:26:19,0.79,Partially cloudy,Partly cloudy throughout the day.,â›…,"43279099999,remote"
Chennai,13/5/15,31.1,27.1,29,39,30.8,34.3,25,79.4,5.1,100,8.33,rain,0,0,25.2,14.8,177.2,1007.2,68.8,5.8,106.3,9.1,6,,2015-05-13 5:44:02,2015-05-13 18:26:34,0.83,"Rain, Partially cloudy",Partly cloudy throughout the day with morning rain.,ğŸŒ§ï¸,4.33E+10
Chennai,14/5/15,32.1,27.1,29.1,40.8,31.4,36,26.4,85.3,15,100,8.33,rain,0,0,30.6,14.8,86.5,1007.4,66.7,5.6,133.7,11.5,5,,2015-05-14 5:43:46,2015-05-14 18:26:49,0.86,"Rain, Partially cloudy",Partly cloudy throughout the day with morning rain.,ğŸŒ§ï¸,4.33E+10
Chennai,15/5/15,34.1,27.1,29.1,43.7,31.4,35.6,26.2,85.1,5,100,4.17,rain,0,0,25.9,18.4,194.4,1007.6,59.6,5.8,188.6,16.2,7,,2015-05-15 5:43:30,2015-05-15 18:27:04,0.9,"Rain, Partially cloudy",Partly cloudy throughout the day with late afternoon rain.,ğŸŒ§ï¸,"43279099999,remote"
Chennai,16/5/15,32.1,26.1,28.3,42.5,26.1,33.5,25.7,86.1,5,100,4.17,rain,0,0,27,14.8,173.4,1006.1,54.2,5.7,145.1,12.8,7,,2015-05-16 5:43:16,2015-05-16 18:27:20,0.93,"Rain, Partially cloudy",Partly cloudy throughout the day with morning rain.,ğŸŒ§ï¸,4.33E+10
Chennai,17/5/15,35.1,26.1,29.7,44,26.1,35.6,25.5,79.2,0,0,0,,0,0,28.8,18.4,212.7,1004.5,64.2,5.8,147.5,12.9,7,,2015-05-17 5:43:03,2015-05-17 18:27:36,0.97,Partially cloudy,Partly cloudy throughout the day.,â›…,4.33E+10
Chennai,18/5/15,36.1,26.1,30.8,45.1,26.1,36.2,24.6,71.3,0,0,0,,0,0,30.6,18.4,206.4,1004.3,61.7,6.5,227.6,19.6,7,,2015-05-18 5:42:50,2015-05-18 18:27:52,0,Partially cloudy,Partly cloudy throughout the day.,â›…,4.33E+10
Chennai,19/5/15,38.1,28.1,32.5,51,32.8,41.7,26.4,71.6,0,0,0,,0,0,35.6,24.1,195.6,1004.3,37.1,6.9,285.2,24.8,9,,2015-05-19 5:42:38,2015-05-19 18:28:09,0.04,Partially cloudy,Partly cloudy throughout the day.,â›…,4.33E+10
Chennai,20/5/15,39.1,29.1,33.2,51,33.9,41.6,25.6,66.5,0,0,0,,0,0,40.7,22.3,201.9,1004.2,28.2,6.5,299.3,25.9,10,,2015-05-20 5:42:27,2015-05-20 18:28:25,0.07,Partially cloudy,Partly cloudy throughout the day.,â›…,"VOMM,43279099999"
Chennai,21/5/15,39.1,29.1,33.6,48.8,35.8,42.8,26.2,67.4,0,0,0,,0,0,40.3,22.3,202.6,1004,30,6.5,291.9,25,9,,2015-05-21 5:42:17,2015-05-21 18:28:42,0.1,Partially cloudy,Partly cloudy throughout the day.,â›…,4.33E+10
Chennai,22/5/15,39.1,30.1,33.6,48.8,37.6,42.8,26.1,66,0,0,0,,0,0,42.5,22.3,204,1004.2,37.5,6.7,268.2,23.2,9,,2015-05-22 5:42:08,2015-05-22 18:28:59,0.13,Partially cloudy,Partly cloudy throughout the day.,â›…,4.33E+10
Chennai,23/5/15,38.1,30.1,33.9,46.4,36.3,42.5,25.7,64.3,0,0,0,,0,0,40.3,24.1,218.2,1004,39.2,6.4,284.3,24.7,9,,2015-05-23 5:42:00,2015-05-23 18:29:17,0.16,Partially cloudy,Partly cloudy throughout the day.,â›…,4.33E+10
Chennai,24/5/15,42.1,30.1,34.7,51,36.3,43.2,25.3,60.2,0,0,0,,0,0,39.2,20.5,220.5,1004.3,34.2,6.5,293.8,25.4,9,,2015-05-24 5:41:53,2015-05-24 18:29:34,0.2,Partially cloudy,Becoming cloudy in the afternoon.,â›…,4.33E+10
Chennai,25/5/15,42.1,30.1,34.8,48.3,36.3,42.4,24.6,58.9,0,0,0,,0,0,37.4,22.3,227.5,1003.9,30,6.7,292.9,25.4,9,,2015-05-25 5:41:46,2015-05-25 18:29:52,0.25,Partially cloudy,Partly cloudy throughout the day.,â›…,4.33E+10
Chennai,26/5/15,39.1,30.1,33.7,46,36.3,41.4,25,62.7,0,0,0,,0,0,34.2,24.1,222.3,1004.5,40.8,6.2,282.8,24.4,9,,2015-05-26 5:41:40,2015-05-26 18:30:09,0.26,Partially cloudy,Partly cloudy throughout the day.,â›…,4.33E+10
Chennai,27/5/15,38.1,27.1,31.6,46,29.3,38.1,24.7,67.8,0,0,0,,0,0,38.5,27.7,204.2,1004.3,55,5.3,261.7,22.6,9,,2015-05-27 5:41:36,2015-05-27 18:30:27,0.29,Partially cloudy,Becoming cloudy in the afternoon.,â›…,4.33E+10
Chennai,28/5/15,39.1,27.1,32.2,46,28.6,36.4,22,56.4,0,0,0,,0,0,42.1,29.5,222.2,1003.3,58.6,6.2,283.8,24.6,9,,2015-05-28 5:41:32,2015-05-28 18:30:45,0.33,Partially cloudy,Clearing in the afternoon.,â›…,"43279099999,remote"
Chennai,29/5/15,40.1,29.1,32.9,47.3,34.7,40.5,25.3,66.3,0,0,0,,0,0,34.9,25.9,192.9,1003.5,30.8,6.1,291.6,25.2,9,,2015-05-29 5:41:28,2015-05-29 18:31:03,0.36,Partially cloudy,Becoming cloudy in the afternoon.,â›…,4.33E+10
Chennai,30/5/15,36.1,29.1,32.1,43.3,31.4,36.7,22.9,59.1,0,0,0,,0,0,34.6,22.3,176.1,1004.8,30.8,6.3,293.2,25.5,10,,2015-05-30 5:41:26,2015-05-30 18:31:21,0.39,Partially cloudy,Partly cloudy throughout the day.,â›…,4.33E+10
Chennai,31/5/15,38.1,29.1,32.6,48.3,35.6,41.2,25.9,69.2,0,0,0,,0,0,44.3,18.4,194.9,1003.9,38.3,6.3,288.8,25,9,,2015-05-31 5:41:25,2015-05-31 18:31:39,0.42,Partially cloudy,Clearing in the afternoon.,â›…,4.33E+10
Chennai,01/6/15,32.1,28.5,30,40.8,31.4,34.9,23.7,69.2,0.5,100,4.17,rain,0,0,34.6,18.4,179.9,1004.3,76.5,5.5,182.4,15.8,7,,2015-06-01 5:41:24,2015-06-01 18:31:57,0.45,"Rain, Partially cloudy",Partly cloudy throughout the day with afternoon rain.,ğŸŒ§ï¸,"43279099999,remote"
Chennai,02/6/15,37.1,27.1,31.1,43.4,30.2,36.5,24.4,70,1.2,100,8.33,rain,0,0,25.2,22.3,245.8,1005.1,54.2,5.5,232.9,20,8,,2015-06-02 5:41:24,2015-06-02 18:32:15,0.5,"Rain, Partially cloudy",Partly cloudy throughout the day with late afternoon rain.,ğŸŒ§ï¸,4.33E+10
Chennai,03/6/15,37.1,26.1,30.7,42,26.1,35.2,23.5,67.3,0,0,0,,0,0,26.6,18.4,202,1004.9,52.3,6.7,187.8,16.3,8,,2015-06-03 5:41:25,2015-06-03 18:32:33,0.52,Partially cloudy,Partly cloudy throughout the day.,â›…,"43279099999,remote"
Chennai,04/6/15,36.1,29.1,31.6,43.5,35.8,39.6,26.1,74.1,0,0,0,,0,0,33.8,22.3,171.5,1005.3,30,6.5,274.4,23.6,9,,2015-06-04 5:41:27,2015-06-04 18:32:51,0.56,Partially cloudy,Partly cloudy throughout the day.,â›…,4.33E+10
Chennai,05/6/15,36.1,29.1,31.9,46.4,35.8,40.2,26.1,72.7,0,0,0,,0,0,37.1,25.9,174,1005.8,37.5,7.5,268.4,23,9,,2015-06-05 5:41:29,2015-06-05 18:33:09,0.59,Partially cloudy,Partly cloudy throughout the day.,â›…,4.33E+10
Chennai,06/6/15,36.1,28.1,31.6,45.1,31.4,37.7,24.3,65.9,0,0,0,,0,0,29.5,20.5,179.5,1005.3,55,6.4,222.3,19.2,8,,2015-06-06 5:41:32,2015-06-06 18:33:27,0.63,Partially cloudy,Partly cloudy throughout the day.,â›…,4.33E+10
Chennai,07/6/15,38.1,29.1,32.6,49.6,35.8,41.2,26,69.9,0,0,0,,0,0,38.2,22.3,184.1,1004.7,73.3,6.5,270.9,23.5,9,,2015-06-07 5:41:36,2015-06-07 18:33:45,0.67,Partially cloudy,Partly cloudy throughout the day.,â›…,4.33E+10
Chennai,08/6/15,37.1,29.1,32.2,43.5,35.8,40,25.6,69.7,0,0,0,,0,0,37.1,25.9,179,1005.3,41.7,6.4,256.7,22.2,9,,2015-06-08 5:41:41,2015-06-08 18:34:02,0.7,Partially cloudy,Partly cloudy throughout the day.,â›…,4.33E+10
Chennai,09/6/15,36.1,29,32,43.5,32.9,38.5,24.6,65.9,0,0,0,,0,0,27.7,22.3,169.4,1006.1,44.4,7.1,244.6,20.9,8,,2015-06-09 5:41:46,2015-06-09 18:34:20,0.75,Partially cloudy,Partly cloudy throughout the day.,â›…,"43279099999,remote"
Chennai,10/6/15,37.1,26.1,31.2,43.4,26.1,36.3,24.5,69.8,0.4,100,4.17,rain,0,0,33.1,22.3,236,1005.2,57.1,6.6,264.4,22.8,9,,2015-06-10 5:41:53,2015-06-10 18:34:37,0.77,"Rain, Partially cloudy",Partly cloudy throughout the day with early morning rain.,ğŸŒ§ï¸,4.33E+10
Chennai,11/6/15,40.1,28.1,32.9,45.1,31.4,39.5,24.3,62.9,0,0,0,,0,0,41,25.9,224,1004,37.5,6.8,271.3,23.4,9,,2015-06-11 5:41:59,2015-06-11 18:34:54,0.81,Partially cloudy,Partly cloudy throughout the day.,â›…,4.33E+10
Chennai,12/6/15,35.1,26.1,31.2,42.1,26.1,37.3,24.8,69.6,23,100,4.17,rain,0,0,33.5,18.4,230.6,1005.3,39.3,6.5,220.8,19.1,8,,2015-06-12 5:42:07,2015-06-12 18:35:11,0.84,"Rain, Partially cloudy",Partly cloudy throughout the day with early morning rain.,ğŸŒ§ï¸,"43279099999,remote"
Chennai,13/6/15,37.1,29.1,32.2,42.2,35.8,39,24.9,68.1,0,0,0,,0,0,34.9,22.3,198.8,1004.3,35.6,7.4,233.3,20.3,9,,2015-06-13 5:42:15,2015-06-13 18:35:27,0.88,Partially cloudy,Partly cloudy throughout the day.,â›…,4.33E+10
Chennai,14/6/15,38.1,27.1,31.6,44.7,29.3,37.6,24.4,67.4,4,100,4.17,rain,0,0,29.2,22.3,229.7,1003.5,50.8,6.3,243.7,21.2,9,,2015-06-14 5:42:24,2015-06-14 18:35:43,0.92,"Rain, Partially cloudy",Partly cloudy throughout the day with late afternoon rain.,ğŸŒ§ï¸,4.33E+10
Chennai,15/6/15,36.1,29.1,32.3,40.9,31.4,36.3,22.3,57.5,0,0,0,,0,0,34.9,20.5,259,1003,66.7,6.5,245,21.2,9,,2015-06-15 5:42:33,2015-06-15 18:35:59,0.95,Partially cloudy,Partly cloudy throughout the day.,â›…,4.33E+10
Chennai,16/6/15,35.1,29.1,31.5,39.5,31.4,35.2,22.2,58.5,0.1,100,4.17,rain,0,0,38.2,22.3,257.7,1002.7,56.7,6.5,140.5,12.1,6,,2015-06-16 5:42:43,2015-06-16 18:36:15,0,"Rain, Partially cloudy",Partly cloudy throughout the day with late afternoon rain.,ğŸŒ§ï¸,4.33E+10
Chennai,17/6/15,31.1,27.1,28.7,36.7,30.2,32.9,24.1,76.6,5,100,8.33,rain,0,0,31,16.6,230.3,1002,81.7,5.3,58.3,5,2,,2015-06-17 5:42:53,2015-06-17 18:36:30,0.02,"Rain, Partially cloudy",Partly cloudy throughout the day with rain clearing later.,ğŸŒ§ï¸,4.33E+10
Chennai,18/6/15,30.1,27.1,28.2,33.7,29.3,31.7,23.3,75.2,0.5,100,4.17,rain,0,0,30.6,14.8,254.4,1002.4,90.4,4.6,55.9,4.9,2,,2015-06-18 5:43:04,2015-06-18 18:36:44,0.05,"Rain, Overcast",Cloudy skies throughout the day with afternoon rain.,ğŸŒ§ï¸,4.33E+10
Chennai,19/6/15,33.1,26.1,29.1,38,26.1,32.6,23.9,74.8,0.1,100,4.17,rain,0,0,34.9,16.6,238.2,1002.3,90.4,5.3,82.7,7.1,4,,2015-06-19 5:43:16,2015-06-19 18:36:59,0.09,"Rain, Overcast",Cloudy skies throughout the day with late afternoon rain.,ğŸŒ§ï¸,4.33E+10
Chennai,20/6/15,34.1,28.1,30.7,38.4,31.4,34.6,22.8,63.5,0,0,0,,0,0,42.8,25.9,235.6,1001.7,86.7,5.9,111.2,9.6,8,,2015-06-20 5:43:28,2015-06-20 18:37:12,0.12,Partially cloudy,Partly cloudy throughout the day.,â›…,4.33E+10
Chennai,21/6/15,38.1,28.1,32.7,42.4,30.2,35.9,21.3,52.1,0,0,0,,0,0,50.8,37.1,230.4,1001.9,59.2,6.5,156.9,13.4,5,,2015-06-21 5:43:40,2015-06-21 18:37:26,0.15,Partially cloudy,Partly cloudy throughout the day.,â›…,4.33E+10
Chennai,22/6/15,38.1,28.1,33.4,42.4,30.8,36.8,21.3,50.3,0,0,0,,0,0,47.2,27.7,225.2,1003,42.5,6.5,191.5,16.5,7,,2015-06-22 5:43:53,2015-06-22 18:37:39,0.18,Partially cloudy,Partly cloudy throughout the day.,â›…,4.33E+10
Chennai,23/6/15,38.1,28.1,32.8,43.5,31.4,36.8,22.1,54.9,1.6,100,8.33,rain,0,0,46.4,29.5,224.8,1004.1,51.7,6.6,235.3,20.3,8,,2015-06-23 5:44:07,2015-06-23 18:37:51,0.22,"Rain, Partially cloudy",Partly cloudy throughout the day with late afternoon rain.,ğŸŒ§ï¸,4.33E+10
Chennai,24/6/15,39.1,28.1,32.9,44.8,32.1,38.1,23.4,60.2,0,0,0,,0,0,43.6,24.1,216,1005.1,40.8,7,250.2,21.6,8,,2015-06-24 5:44:21,2015-06-24 18:38:03,0.25,Partially cloudy,Partly cloudy throughout the day.,â›…,4.33E+10
Chennai,25/6/15,39.1,30.1,33.8,43.7,33.4,38.6,22.6,54,0.5,100,4.17,rain,0,0,47.5,27.7,219.9,1004.4,45,6.8,205.7,17.6,7,,2015-06-25 5:44:35,2015-06-25 18:38:14,0.28,"Rain, Partially cloudy",Partly cloudy throughout the day with late afternoon rain.,ğŸŒ§ï¸,4.33E+10
Chennai,26/6/15,37.1,30.1,33.8,42.2,33.4,38,22,51,0,0,0,,0,0,42.8,27.7,242.6,1003.6,55,6.7,180.9,15.7,7,,2015-06-26 5:44:49,2015-06-26 18:38:25,0.31,Partially cloudy,Partly cloudy throughout the day.,â›…,4.33E+10
Chennai,27/6/15,38.1,29.1,33,42.4,33.8,37.6,22.6,56.2,0.4,100,4.17,rain,0,0,44.6,26.3,234.4,1004,68.5,5.5,186.4,16.1,6,,2015-06-27 5:45:04,2015-06-27 18:38:35,0.34,"Rain, Partially cloudy",Partly cloudy throughout the day with afternoon rain.,ğŸŒ§ï¸,"43279099999,remote"
Chennai,28/6/15,39.1,28.1,31.6,42.7,31.4,36.3,23.2,63.5,28,100,12.5,rain,0,0,33.8,20.5,223.5,1005.8,53.8,6,237.5,20.4,8,,2015-06-28 5:45:19,2015-06-28 18:38:44,0.38,"Rain, Partially cloudy",Becoming cloudy in the afternoon with rain.,ğŸŒ§ï¸,4.33E+10
Chennai,29/6/15,38.1,28.1,32,42.4,32.1,37.2,23.8,64.8,0,0,0,,0,0,40.7,22.3,207.6,1007.2,45,6.3,247.6,21.3,8,,2015-06-29 5:45:35,2015-06-29 18:38:53,0.41,Partially cloudy,Partly cloudy throughout the day.,â›…,4.33E+10
Chennai,30/6/15,38.1,27.1,31.8,41.5,29.7,36.6,23.3,62.7,0.2,100,4.17,rain,0,0,34.9,25.9,226.5,1007.2,41.7,6.3,235,20.3,8,,2015-06-30 5:45:50,2015-06-30 18:39:01,0.44,"Rain, Partially cloudy",Partly cloudy throughout the day with late afternoon rain.,ğŸŒ§ï¸,4.33E+10
Chennai,01/7/15,38.1,28.1,31.9,42.4,32.8,37.2,23.7,64,0,0,0,,0,0,34.9,22.3,214.9,1007.4,55.8,6.6,259.2,22.5,9,,2015-07-01 5:46:05,2015-07-01 18:39:08,0.47,Partially cloudy,Partly cloudy throughout the day.,â›…,4.33E+10
Chennai,02/7/15,38.1,29.1,32.4,41.5,33.7,37.6,23.4,61.8,2,100,4.17,rain,0,0,32.8,24.1,222.7,1007.7,45.8,6.3,265.4,22.9,9,,2015-07-02 5:46:21,2015-07-02 18:39:14,0.5,"Rain, Partially cloudy",Partly cloudy throughout the day with late afternoon rain.,ğŸŒ§ï¸,4.33E+10
Chennai,03/7/15,38.1,29.1,32.4,41.5,34.7,37.8,23.6,62.1,0,0,0,,0,0,30.2,22.3,222,1007.3,69.2,6.8,229.2,19.9,8,,2015-07-03 5:46:38,2015-07-03 18:39:20,0.54,Partially cloudy,Partly cloudy throughout the day.,â›…,4.33E+10
Chennai,04/7/15,38.1,29.1,33.3,43.5,33.7,38.7,23.4,58.3,0,0,0,,0,0,36.7,25.9,244.8,1006.1,40.8,6.8,269.8,23.2,8,,2015-07-04 5:46:54,2015-07-04 18:39:26,0.58,Partially cloudy,Partly cloudy throughout the day.,â›…,4.33E+10
Chennai,05/7/15,40.1,30.1,34.1,44,33.4,38.8,22.4,52.8,0,0,0,,0,0,36.4,20.5,241.8,1004.3,20.8,6.7,271.2,23.6,9,,2015-07-05 5:47:11,2015-07-05 18:39:30,0.61,Partially cloudy,Partly cloudy throughout the day.,â›…,4.33E+10
Chennai,06/7/15,40.1,31.1,33.8,41.6,33.1,38.3,22,52.9,0,0,0,,0,0,35.3,27.7,247.4,1003.5,30.1,6.6,294.1,25.3,9,,2015-07-06 5:47:27,2015-07-06 18:39:34,0.65,Partially cloudy,Partly cloudy throughout the day.,â›…,"43279099999,remote"
Chennai,07/7/15,39.1,30.1,33.2,40.8,31.4,36.7,20.9,51.2,0,0,0,,0,0,40,25.9,235.2,1003.3,32.1,6.7,270,23.4,9,,2015-07-07 5:47:44,2015-07-07 18:39:37,0.69,Partially cloudy,Partly cloudy throughout the day.,â›…,4.33E+10
Chennai,08/7/15,39.1,29.1,32.9,42.7,32.6,37.7,22.8,57.7,0,0,0,,0,0,37.1,25.9,228.7,1003.9,38.8,6.2,239.7,20.7,9,,2015-07-08 5:48:01,2015-07-08 18:39:39,0.72,Partially cloudy,Partly cloudy throughout the day.,â›…,4.33E+10
Chennai,09/7/15,39.1,29.1,33.2,42.7,32.6,37.6,22.4,54.9,2,100,4.17,rain,0,0,35.6,22.3,245.2,1004.5,44.2,6.6,225.8,19.5,8,,2015-07-09 5:48:18,2015-07-09 18:39:40,0.75,"Rain, Partially cloudy",Partly cloudy throughout the day with late afternoon rain.,ğŸŒ§ï¸,4.33E+10
Chennai,10/7/15,39.1,29.1,32.8,43.7,33.4,37.5,22.9,58,0.5,100,4.17,rain,0,0,39.6,27.7,247.1,1002.9,56.7,6.1,201.1,17.2,7,,2015-07-10 5:48:35,2015-07-10 18:39:41,0.79,"Rain, Partially cloudy",Partly cloudy throughout the day with late afternoon rain.,ğŸŒ§ï¸,"43279099999,remote"
Chennai,11/7/15,39.1,26.1,31.6,43.7,26.1,36.3,23.6,65.1,8,100,4.17,rain,0,0,40.3,22.3,221,1003.8,57.5,6.2,195.6,17,7,,2015-07-11 5:48:51,2015-07-11 18:39:41,0.83,"Rain, Partially cloudy",Partly cloudy throughout the day with early morning rain.,ğŸŒ§ï¸,4.33E+10
Chennai,12/7/15,38.1,28.1,32.1,42.4,32.1,37.1,23.5,62.8,0.1,100,4.17,rain,0,0,34.6,22.3,212.8,1004.2,40,6.5,254,22,9,,2015-07-12 5:49:08,2015-07-12 18:39:39,0.86,"Rain, Partially cloudy",Partly cloudy throughout the day with early morning rain.,ğŸŒ§ï¸,4.33E+10
Chennai,13/7/15,39.1,27.1,32.5,43.7,30.2,37.7,23.6,61.6,0,0,0,,0,0,33.1,22.3,217.8,1003.7,43.3,6.5,258.8,22.3,9,,2015-07-13 5:49:25,2015-07-13 18:39:37,0.9,Partially cloudy,Partly cloudy throughout the day.,â›…,4.33E+10
Chennai,14/7/15,37.1,28.1,32.1,42.2,32.1,37.6,23.8,63.2,2,100,4.17,rain,0,0,28.4,22.3,232.6,1002.5,71.7,5.6,216.3,18.7,8,,2015-07-14 5:49:42,2015-07-14 18:39:34,0.94,"Rain, Partially cloudy",Partly cloudy throughout the day with morning rain.,ğŸŒ§ï¸,4.33E+10
Chennai,15/7/15,35.1,28.1,30.9,43.7,32.8,36.6,24.4,69.6,0,0,0,,0,0,37.4,20.5,235.2,1001.7,81.7,5.8,166.3,14.4,6,,2015-07-15 5:49:58,2015-07-15 18:39:31,0.97,Partially cloudy,Partly cloudy throughout the day.,â›…,4.33E+10
Chennai,16/7/15,38.1,28.1,32,41.5,32.1,36.7,23.1,61.7,0,0,0,,0,0,34.9,24.1,241.2,1001.2,36.3,6.1,219.3,19,8,,2015-07-16 5:50:15,2015-07-16 18:39:26,0,Partially cloudy,Partly cloudy throughout the day.,â›…,4.33E+10
Chennai,17/7/15,38.1,27.1,30.9,42.4,30.8,35.4,23.7,68.2,3,100,4.17,rain,0,0,48.2,24.1,231.3,1001.8,70.8,5.8,205.2,17.8,7,,2015-07-17 5:50:31,2015-07-17 18:39:21,0.04,"Rain, Partially cloudy",Partly cloudy throughout the day with late afternoon rain.,ğŸŒ§ï¸,4.33E+10
Chennai,18/7/15,38.1,26.1,30.7,43.5,26.1,35.2,24.1,70.5,45,100,12.5,rain,0,0,39.2,20.5,221.8,1003,67.9,6.2,213.6,18.6,8,,2015-07-18 5:50:47,2015-07-18 18:39:14,0.07,"Rain, Partially cloudy",Partly cloudy throughout the day with rain.,ğŸŒ§ï¸,4.33E+10
Chennai,19/7/15,36.1,26.1,30.6,42.1,26.1,35,23.6,68,0.1,100,4.17,rain,0,0,42.8,22.3,249.4,1003.3,77.9,6.3,187.9,16.1,7,,2015-07-19 5:51:03,2015-07-19 18:39:07,0.1,"Rain, Partially cloudy",Partly cloudy throughout the day with late afternoon rain.,ğŸŒ§ï¸,4.33E+10
Chennai,20/7/15,37.1,28.1,31.3,42.2,29.7,35.1,22.2,59.6,3,100,4.17,rain,0,0,51.5,22.3,232.2,1002.5,52.6,6.1,170.4,14.6,5,,2015-07-20 5:51:19,2015-07-20 18:38:59,0.14,"Rain, Partially cloudy",Partly cloudy throughout the day with late afternoon rain.,ğŸŒ§ï¸,"43279099999,remote"
Chennai,21/7/15,37.1,27.1,31.3,43.4,29.7,36.3,23.7,65.9,7,100,8.33,rain,0,0,34.2,24.1,221.2,1002.9,42.9,6.6,219.8,19.1,8,,2015-07-21 5:51:35,2015-07-21 18:38:50,0.17,"Rain, Partially cloudy",Partly cloudy throughout the day with rain.,ğŸŒ§ï¸,"43279099999,remote"
Chennai,22/7/15,35.1,26.1,29.1,40.7,26.1,32.7,23.9,74.7,25,100,4.17,rain,0,0,38.9,24.1,218.2,1004.1,58.8,6.2,243.5,21.1,8,,2015-07-22 5:51:50,2015-07-22 18:38:40,0.2,"Rain, Partially cloudy",Partly cloudy throughout the day with late afternoon rain.,ğŸŒ§ï¸,"43279099999,remote"
Chennai,23/7/15,36.1,26.1,29.5,43.3,26.1,33.3,24.3,75.1,17,100,4.17,rain,0,0,37.8,25.9,212.6,1005.8,70.4,5.9,251.2,21.7,9,,2015-07-23 5:52:05,2015-07-23 18:38:29,0.23,"Rain, Partially cloudy",Partly cloudy throughout the day with late afternoon rain.,ğŸŒ§ï¸,4.33E+10
Chennai,24/7/15,36.1,26.1,30.2,43.3,26.1,34.9,24.7,74.3,0,0,0,,0,0,32.8,20.5,209.2,1006.5,50,6.7,245.7,21.2,8,,2015-07-24 5:52:20,2015-07-24 18:38:17,0.25,Partially cloudy,Partly cloudy throughout the day.,â›…,4.33E+10
Chennai,25/7/15,36.1,28.1,31.1,42.1,32.8,37.3,24.8,70.8,0,0,0,,0,0,34.6,24.1,220.5,1005.9,44.2,6.5,225.3,19.4,9,,2015-07-25 5:52:35,2015-07-25 18:38:04,0.3,Partially cloudy,Partly cloudy throughout the day.,â›…,4.33E+10
Chennai,26/7/15,35.1,27.1,30.9,40.8,30.2,35.9,23.9,68,0,0,0,,0,0,31,18.4,216.8,1006.4,53.8,7,166.3,14.6,6,,2015-07-26 5:52:49,2015-07-26 18:37:51,0.33,Partially cloudy,Partly cloudy throughout the day.,â›…,"43279099999,remote"
Chennai,27/7/15,36.1,26.1,29.6,43.3,26.1,33.8,24.5,76.4,6.9,100,8.33,rain,0,0,29.9,22.3,240.4,1007.4,81.3,5.8,146.4,12.7,5,,2015-07-27 5:53:03,2015-07-27 18:37:36,0.36,"Rain, Partially cloudy",Partly cloudy throughout the day with rain.,ğŸŒ§ï¸,4.33E+10
Chennai,28/7/15,36.1,26.1,30,43.7,26.1,34.2,24.1,72.3,13,100,4.17,rain,0,0,30.6,20.5,232.3,1007.6,80,6.3,238.7,20.5,9,,2015-07-28 5:53:17,2015-07-28 18:37:21,0.4,"Rain, Partially cloudy",Partly cloudy throughout the day with late afternoon rain.,ğŸŒ§ï¸,4.33E+10
Chennai,29/7/15,36.1,26.1,30.2,40.9,26.1,34.5,23.9,70.9,0,0,0,,0,0,32.8,20.5,212.8,1006.8,62.5,6.7,250.7,21.7,8,,2015-07-29 5:53:30,2015-07-29 18:37:04,0.43,Partially cloudy,Partly cloudy throughout the day.,â›…,4.33E+10
Chennai,30/7/15,35.1,28.1,31.1,40.8,32.8,36.5,24,68.1,0,0,0,,0,0,35.6,18.4,224.8,1006.8,47.5,6.2,254.1,21.9,9,,2015-07-30 5:53:43,2015-07-30 18:36:47,0.46,Partially cloudy,Partly cloudy throughout the day.,â›…,4.33E+10
Chennai,31/7/15,34.1,28.1,30.8,39.5,32.8,36.2,24.2,69.1,0,0,0,,0,0,31.3,20.5,223.1,1006.5,49.2,6.5,194.5,16.6,8,,2015-07-31 5:53:56,2015-07-31 18:36:29,0.5,Partially cloudy,Partly cloudy throughout the day.,â›…,4.33E+10
Chennai,01/8/15,35.1,24.1,29.4,42.1,24.1,33.6,24.6,76.9,56,100,4.17,rain,0,0,28.8,20.5,241.9,1007.3,80,5.3,197.6,17.2,7,,2015-08-01 5:54:09,2015-08-01 18:36:10,0.53,"Rain, Partially cloudy",Partly cloudy throughout the day with early morning rain.,ğŸŒ§ï¸,4.33E+10
Chennai,02/8/15,33.1,25.1,28.5,40.7,25.1,32.4,24.5,79.7,9.4,100,12.5,rain,0,0,32.8,18.4,237.8,1007.3,79.6,6,108.7,9.2,5,,2015-08-02 5:54:21,2015-08-02 18:35:50,0.56,"Rain, Partially cloudy",Partly cloudy throughout the day with rain clearing later.,ğŸŒ§ï¸,4.33E+10
Chennai,03/8/15,35.1,28.1,30.9,42.1,32.8,36.9,24.9,71.6,8.6,100,4.17,rain,0,0,32.8,16.6,215.1,1005.8,75,6,236.4,20.4,8,,2015-08-03 5:54:33,2015-08-03 18:35:30,0.6,"Rain, Partially cloudy",Partly cloudy throughout the day with early morning rain.,ğŸŒ§ï¸,4.33E+10
Chennai,04/8/15,36.1,25.1,30.1,44.8,25.1,34.7,23.8,70.4,46,100,4.17,rain,0,0,34.2,16.6,241.3,1005.5,74.5,6.2,214.6,18.6,8,,2015-08-04 5:54:44,2015-08-04 18:35:08,0.63,"Rain, Partially cloudy",Partly cloudy throughout the day with late afternoon rain.,ğŸŒ§ï¸,"43279099999,remote"
Chennai,05/8/15,35.1,24.1,29.2,42.1,24.1,33.3,24.3,76.6,30.2,100,12.5,rain,0,0,32,22.3,195.1,1005.4,72.5,5.7,217.2,18.6,8,,2015-08-05 5:54:55,2015-08-05 18:34:46,0.67,"Rain, Partially cloudy",Partly cloudy throughout the day with rain.,ğŸŒ§ï¸,4.33E+10
Chennai,06/8/15,35.1,28.1,30.8,42.1,30.8,36,24,68.2,0.4,100,4.17,rain,0,0,38.5,22.3,264.4,1004.1,45.8,6.9,215.7,18.6,9,,2015-08-06 5:55:06,2015-08-06 18:34:23,0.71,"Rain, Partially cloudy",Partly cloudy throughout the day with late afternoon rain.,ğŸŒ§ï¸,4.33E+10
Chennai,07/8/15,35.1,28.1,30.3,42,30.8,35.8,24.5,71.7,6,100,4.17,rain,0,0,34.6,15.5,217.4,1003.9,55.6,6.1,196.1,16.9,7,,2015-08-07 5:55:16,2015-08-07 18:33:59,0.75,"Rain, Partially cloudy",Partly cloudy throughout the day with late afternoon rain.,ğŸŒ§ï¸,"43279099999,remote"
Chennai,08/8/15,36.1,27.1,30.9,43.3,30.2,36.4,24.6,71.5,0.1,100,4.17,rain,0,0,33.8,22.3,268,1003.9,80.4,6.3,214.8,18.5,8,,2015-08-08 5:55:26,2015-08-08 18:33:34,0.78,"Rain, Partially cloudy",Partly cloudy throughout the day with late afternoon rain.,ğŸŒ§ï¸,4.33E+10
Chennai,09/8/15,36.1,28.1,31.4,42.1,32.8,37.1,24.3,67.2,0,0,0,,0,0,33.5,22.3,227,1002.1,68.3,6.8,203,17.6,7,,2015-08-09 5:55:35,2015-08-09 18:33:08,0.81,Partially cloudy,Partly cloudy throughout the day.,â›…,4.33E+10
Chennai,10/8/15,36.1,28.1,31.4,42.1,32.1,36.9,24,65.9,1,100,4.17,rain,0,0,36.4,22.3,245.8,1001.7,61.7,6.7,196.3,16.7,7,,2015-08-10 5:55:45,2015-08-10 18:32:42,0.85,"Rain, Partially cloudy",Partly cloudy throughout the day with late afternoon rain.,ğŸŒ§ï¸,4.33E+10
Chennai,11/8/15,35.1,27.1,30.5,42,30.8,36.1,24.6,72.1,0,0,0,,0,0,34.9,18.4,198.6,1003.4,73.3,6.5,193.9,16.8,7,,2015-08-11 5:55:53,2015-08-11 18:32:15,0.88,Partially cloudy,Partly cloudy throughout the day.,â›…,4.33E+10
Chennai,12/8/15,34.1,28.1,30.6,39.5,32.1,35.6,23.9,68.3,0.1,100,4.17,rain,0,0,33.8,18.4,251.3,1004.5,71.7,6.3,165.5,14.2,6,,2015-08-12 5:56:02,2015-08-12 18:31:47,0.92,"Rain, Partially cloudy",Partly cloudy throughout the day with late afternoon rain.,ğŸŒ§ï¸,4.33E+10
Chennai,13/8/15,35.1,28.1,31.1,42,30.8,36.7,24.1,66.9,0,0,0,,0,0,33.5,14.8,238.6,1004.8,37.5,6.2,213,18.3,8,,2015-08-13 5:56:10,2015-08-13 18:31:18,0.95,Partially cloudy,Partly cloudy throughout the day.,â›…,4.33E+10
Chennai,14/8/15,36.1,27.1,30.7,42.1,30.8,37,25.1,73.4,0,0,0,,0,0,30.2,20.5,151.8,1005,40.8,6.3,263.4,22.7,9,,2015-08-14 5:56:18,2015-08-14 18:30:49,0,Partially cloudy,Partly cloudy throughout the day.,â›…,4.33E+10
Chennai,15/8/15,36.1,28.1,31.4,45.1,32.1,38.3,25.2,71,0,0,0,,0,0,28.4,18.4,181.2,1006,37.9,6.5,240.6,20.9,9,,2015-08-15 5:56:25,2015-08-15 18:30:19,0.02,Partially cloudy,Partly cloudy throughout the day.,â›…,4.33E+10
Chennai,16/8/15,34.1,26.1,29.4,42.3,26.1,34.7,25.4,79.7,10,100,8.33,rain,0,0,32.4,16.6,248.3,1007.7,63.3,6.8,222.2,19.1,7,,2015-08-16 5:56:32,2015-08-16 18:29:48,0.05,"Rain, Partially cloudy",Partly cloudy throughout the day with early morning rain.,ğŸŒ§ï¸,4.33E+10
Chennai,17/8/15,35.1,27.1,30.6,43.5,30.2,37,25.4,75,0,0,0,,0,0,29.5,14.8,175.3,1006.9,35.4,7.1,245.2,21.1,9,,2015-08-17 5:56:38,2015-08-17 18:29:16,0.09,Partially cloudy,Partly cloudy throughout the day.,â›…,4.33E+10
Chennai,18/8/15,34.1,27.1,30.7,43.7,31.4,37.8,25.8,75.8,0,0,0,,0,0,33.8,13,155.8,1007.7,38.3,6.4,239.9,20.8,8,,2015-08-18 5:56:45,2015-08-18 18:28:44,0.12,Partially cloudy,Partly cloudy throughout the day.,â›…,4.33E+10
Chennai,19/8/15,34.1,29.1,31,40.7,34.7,37.7,25.3,72.5,0,0,0,,0,0,36.4,22.3,160.7,1008.4,35.8,6.8,239.8,20.6,7,,2015-08-19 5:56:51,2015-08-19 18:28:12,0.15,Partially cloudy,Partly cloudy throughout the day.,â›…,4.33E+10
Chennai,20/8/15,36.1,27.1,30.9,48.3,29.7,38.1,25.4,73.2,0,0,0,,0,0,34.2,18.4,192.2,1008,42.5,6.7,262.3,22.7,9,,2015-08-20 5:56:56,2015-08-20 18:27:38,0.19,Partially cloudy,Partly cloudy throughout the day.,â›…,4.33E+10
Chennai,21/8/15,32.1,24.1,27.6,40.8,24.1,31,24.6,84.4,33,100,16.67,rain,0,0,25.9,13,220.7,1008.5,94,5.3,247,21.5,9,,2015-08-21 5:57:01,2015-08-21 18:27:04,0.22,"Rain, Overcast",Cloudy skies throughout the day with rain.,ğŸŒ§ï¸,"43279099999,remote"
Chennai,22/8/15,32.1,24.1,27.9,39.3,24.1,31.1,24.5,82.7,0.9,100,4.17,rain,0,0,26.6,18.4,249.1,1007.2,81.7,6.4,100,8.6,3,,2015-08-22 5:57:06,2015-08-22 18:26:29,0.25,"Rain, Partially cloudy",Partly cloudy throughout the day with late afternoon rain.,ğŸŒ§ï¸,4.33E+10
Chennai,23/8/15,34.1,25.1,29.4,40.7,25.1,33.3,24.4,75.8,0.9,100,4.17,rain,0,0,32.4,18.4,279,1006.5,68.3,6.7,156.4,13.3,6,,2015-08-23 5:57:11,2015-08-23 18:25:54,0.25,"Rain, Partially cloudy",Partly cloudy throughout the day with early morning rain.,ğŸŒ§ï¸,4.33E+10
Chennai,24/8/15,35.1,26.1,30.5,42,26.1,35.1,23.9,68.8,0,0,0,,0,0,29.5,22.3,256.8,1006.9,43.3,7.1,234.8,20,8,,2015-08-24 5:57:15,2015-08-24 18:25:19,0.32,Partially cloudy,Partly cloudy throughout the day.,â›…,4.33E+10
Chennai,25/8/15,36.1,27.1,31.1,40.9,30.8,36.1,23.8,66.4,0,0,0,,0,0,29.9,24.1,263.7,1006,40.8,6.7,265.4,22.9,9,,2015-08-25 5:57:19,2015-08-25 18:24:42,0.35,Partially cloudy,Partly cloudy throughout the day.,â›…,4.33E+10
Chennai,26/8/15,35.1,28.1,31.4,40.8,32.8,37,24.1,66.3,0,0,0,,0,0,31,18.4,229.7,1004.6,45,6.6,184.6,16,7,,2015-08-26 5:57:23,2015-08-26 18:24:05,0.38,Partially cloudy,Partly cloudy throughout the day.,â›…,4.33E+10
Chennai,27/8/15,32.1,26.1,29.1,39.3,26.1,33.6,24.4,76.1,0.8,100,4.17,rain,0,0,36.4,20.5,229.8,1004.8,90.4,5.6,179.8,15.6,7,,2015-08-27 5:57:26,2015-08-27 18:23:28,0.42,"Rain, Overcast",Cloudy skies throughout the day with early morning rain.,ğŸŒ§ï¸,"43279099999,remote"
Chennai,28/8/15,34.1,27.1,30,39.5,29.7,34.8,24.1,71.7,0.4,100,4.17,rain,0,0,30.6,18.4,234.5,1005.5,73.3,6.8,204.9,17.8,7,,2015-08-28 5:57:29,2015-08-28 18:22:50,0.45,"Rain, Partially cloudy",Partly cloudy throughout the day with early morning rain.,ğŸŒ§ï¸,4.33E+10
Chennai,29/8/15,36.1,27.1,31,40.9,30.8,36.1,24.1,69.1,0,0,0,,0,0,31.3,18.4,228.5,1005.3,29.2,6.9,278.4,24,10,,2015-08-29 5:57:32,2015-08-29 18:22:12,0.48,Partially cloudy,Partly cloudy throughout the day.,â›…,4.33E+10
Chennai,30/8/15,37.1,28.1,31.4,43.5,32.8,37.8,24.9,69.4,1,100,4.17,rain,0,0,28.4,18.4,216,1006.2,60.8,6.2,260.3,22.4,9,,2015-08-30 5:57:34,2015-08-30 18:21:33,0.5,"Rain, Partially cloudy",Partly cloudy throughout the day with early morning rain.,ğŸŒ§ï¸,4.33E+10
Chennai,31/8/15,35.1,25.1,30.1,43.5,25.1,34.8,24.8,75.2,1,100,4.17,rain,0,0,27,22.3,238.5,1007.3,53.3,6.4,251.6,21.7,9,,2015-08-31 5:57:37,2015-08-31 18:20:54,0.55,"Rain, Partially cloudy",Clearing in the afternoon with early morning rain.,ğŸŒ§ï¸,4.33E+10
Chennai,01/9/15,36.1,29.1,31.8,44.8,33.7,39.2,25.4,70.2,0,0,0,,0,0,29.9,18.4,205.4,1006.2,34.6,6.3,263.7,22.8,9,,2015-09-01 5:57:39,2015-09-01 18:20:15,0.59,Partially cloudy,Partly cloudy throughout the day.,â›…,4.33E+10
Chennai,02/9/15,37.1,28.1,31.3,46.9,31.4,38.2,25.2,71.1,0,0,0,,0,0,30.2,18.4,188.4,1005.8,38.8,6,247.2,21.3,9,,2015-09-02 5:57:41,2015-09-02 18:19:35,0.62,Partially cloudy,Partly cloudy throughout the day.,â›…,4.33E+10
Chennai,03/9/15,34.1,27.1,30.2,42.1,30.2,36.9,25.6,76.9,0,0,0,,0,0,33.5,18.4,199.4,1007.4,68.3,6.2,229.6,19.8,8,,2015-09-03 5:57:42,2015-09-03 18:18:55,0.65,Partially cloudy,Partly cloudy throughout the day.,â›…,4.33E+10
Chennai,04/9/15,34.1,28.1,30.9,43.7,33.7,38.2,25.8,75.4,0,0,0,,0,0,28.4,20.5,153,1009.3,42.5,6.2,261.1,22.6,9,,2015-09-04 5:57:44,2015-09-04 18:18:14,0.69,Partially cloudy,Partly cloudy throughout the day.,â›…,4.33E+10
Chennai,05/9/15,34.1,27.1,30.6,43.7,31.4,38.1,26.1,77.9,0,0,0,,0,0,33.8,18.4,163.7,1010,37.5,6,241.8,20.9,9,,2015-09-05 5:57:45,2015-09-05 18:17:33,0.75,Partially cloudy,Partly cloudy throughout the day.,â›…,4.33E+10
Chennai,06/9/15,36.1,28.1,31.2,43.3,32.8,38,25.3,72.2,0,0,0,,0,0,40.3,22.3,196.2,1009.2,39.2,6.8,250.6,21.5,9,,2015-09-06 5:57:46,2015-09-06 18:16:52,0.76,Partially cloudy,Partly cloudy throughout the day.,â›…,4.33E+10
Chennai,07/9/15,32.1,26.1,28.9,37.9,26.1,33.2,24.1,75.4,0,0,0,,0,0,32,20.5,223.4,1009.6,85,6,160.5,14,7,,2015-09-07 5:57:47,2015-09-07 18:16:11,0.79,Partially cloudy,Partly cloudy throughout the day.,â›…,4.33E+10
Chennai,08/9/15,34.1,26.1,29.6,39.5,26.1,33.6,24.5,76.4,0.4,100,4.17,rain,0,0,28.1,22.3,218.7,1008.8,60,6.4,207.1,17.9,8,,2015-09-08 5:57:48,2015-09-08 18:15:29,0.83,"Rain, Partially cloudy",Partly cloudy throughout the day with early morning rain.,ğŸŒ§ï¸,4.33E+10
Chennai,09/9/15,33.1,27.1,30.3,40.7,30.2,35.9,24.6,72.8,0,0,0,,0,0,28.8,16.6,199.2,1008.1,60,6.4,198.3,17.1,8,,2015-09-09 5:57:49,2015-09-09 18:14:47,0.86,Partially cloudy,Partly cloudy throughout the day.,â›…,4.33E+10
Chennai,10/9/15,34.1,24.1,28.9,40.7,24.1,33.5,24.8,79.7,34.2,100,8.33,rain,0,0,23.8,37.1,221.5,1008,90,5.7,204.5,17.8,8,,2015-09-10 5:57:49,2015-09-10 18:14:05,0.9,"Rain, Partially cloudy",Partly cloudy throughout the day with rain.,ğŸŒ§ï¸,"43279099999,remote"
Chennai,11/9/15,33.1,27.1,30.1,39.4,31.4,35.9,25.1,76.4,0.5,100,4.17,rain,0,0,27.4,16.6,242.7,1007.1,85,5.9,126,10.9,5,,2015-09-11 5:57:50,2015-09-11 18:13:22,0.93,"Rain, Partially cloudy",Partly cloudy throughout the day with late afternoon rain.,ğŸŒ§ï¸,4.33E+10
Chennai,12/9/15,34.1,28.1,30.2,38.4,31.4,35.2,24,70.6,0,0,0,,0,0,29.2,14.8,253.3,1007,80.4,6.3,159,13.7,6,,2015-09-12 5:57:50,2015-09-12 18:12:40,0.97,Partially cloudy,Partly cloudy throughout the day.,â›…,4.33E+10
Chennai,13/9/15,36.1,27.1,30.6,40.9,30.8,35.6,24,69.6,0.1,100,4.17,rain,0,0,31,22.3,214.7,1007.2,35.8,6.9,240.8,20.9,9,,2015-09-13 5:57:51,2015-09-13 18:11:57,0,"Rain, Partially cloudy",Partly cloudy throughout the day with late afternoon rain.,ğŸŒ§ï¸,4.33E+10
Chennai,14/9/15,34.1,27.1,30.4,40.7,30.2,35,23.7,68.7,0,0,0,,0,0,32,27.7,232.7,1006.2,60.8,6,181.7,15.6,7,,2015-09-14 5:57:51,2015-09-14 18:11:14,0.03,Partially cloudy,Partly cloudy throughout the day.,â›…,4.33E+10
Chennai,15/9/15,36.1,28.1,31.5,40.9,30.2,36.4,23.2,62.8,0,0,0,,0,0,36.7,25.9,251.2,1004.7,57.5,6.3,158.4,13.7,6,,2015-09-15 5:57:51,2015-09-15 18:10:32,0.07,Partially cloudy,Partly cloudy throughout the day.,â›…,4.33E+10
Chennai,16/9/15,36.1,29.1,32,42.1,31.4,36.6,22.9,59.6,0,0,0,,0,0,42.1,22.3,250.1,1002.7,33.3,6.3,254.2,22,9,,2015-09-16 5:57:51,2015-09-16 18:09:49,0.1,Partially cloudy,Partly cloudy throughout the day.,â›…,4.33E+10
Chennai,17/9/15,36.1,28.1,31.7,42.1,30.8,36.8,23.4,62.9,5,100,4.17,rain,0,0,33.1,20.5,253.2,1002.3,49.2,6.4,232.6,19.9,9,,2015-09-17 5:57:52,2015-09-17 18:09:06,0.13,"Rain, Partially cloudy",Partly cloudy throughout the day with late afternoon rain.,ğŸŒ§ï¸,4.33E+10
Chennai,18/9/15,35.1,28.1,30.9,40.8,30.8,36.1,24,68.1,0,0,0,,0,0,26.3,20.5,222.7,1003.3,64.2,6,213.3,18.5,7,,2015-09-18 5:57:52,2015-09-18 18:08:23,0.17,Partially cloudy,Partly cloudy throughout the day.,â›…,4.33E+10
Chennai,19/9/15,34.1,27.1,30.5,40.8,30.8,37,25.5,76,0.9,100,4.17,rain,0,0,27,14.8,202.8,1004.5,86.7,6.1,147,12.8,5,,2015-09-19 5:57:52,2015-09-19 18:07:39,0.2,"Rain, Partially cloudy",Partly cloudy throughout the day with early morning rain.,ğŸŒ§ï¸,4.33E+10
Chennai,20/9/15,36.1,28.1,31.1,42.3,33.7,38.3,25.7,74.6,0,0,0,,0,0,26.3,18.4,202,1004.8,73.7,6.5,218.5,18.9,8,,2015-09-20 5:57:52,2015-09-20 18:06:56,0.24,Partially cloudy,Partly cloudy throughout the day.,â›…,"43279099999,remote"
Chennai,21/9/15,35.1,25.1,29.7,39.5,25.1,34,24.6,76.7,30,100,8.33,rain,0,0,24.1,14.8,226.8,1006.4,58.8,6.5,257.1,22.3,9,,2015-09-21 5:57:53,2015-09-21 18:06:13,0.25,"Rain, Partially cloudy",Partly cloudy throughout the day with early morning rain.,ğŸŒ§ï¸,4.33E+10
Chennai,22/9/15,34.1,28.1,30.6,42.3,33.7,38.1,26,77.3,0,0,0,,0,0,28.4,18.4,155.5,1007.1,40,6.4,244.7,21,8,,2015-09-22 5:57:53,2015-09-22 18:05:31,0.3,Partially cloudy,Partly cloudy throughout the day.,â›…,4.33E+10
Chennai,23/9/15,35.1,28.1,31,43.5,34.7,38.2,25.8,75.1,0,0,0,,0,0,28.8,18.4,166.3,1008.4,35.4,6.3,264.9,23,9,,2015-09-23 5:57:54,2015-09-23 18:04:48,0.34,Partially cloudy,Partly cloudy throughout the day.,â›…,4.33E+10
Chennai,24/9/15,36.1,27.1,31,45.1,31.4,38.2,25.8,74.9,0,0,0,,0,0,32.4,22.3,177,1007.8,38.3,6.3,271.6,23.5,9,,2015-09-24 5:57:54,2015-09-24 18:04:05,0.37,Partially cloudy,Partly cloudy throughout the day.,â›…,4.33E+10
Chennai,25/9/15,37.1,28.1,31.3,45.1,32.8,38.6,25.6,73.5,0,0,0,,0,0,29.9,18.4,183.2,1006.2,35.4,6.6,266.8,23,9,,2015-09-25 5:57:55,2015-09-25 18:03:22,0.4,Partially cloudy,Partly cloudy throughout the day.,â›…,4.33E+10
Chennai,26/9/15,36.1,26.1,30.5,43.7,26.1,36.5,25.2,74.8,0,0,0,,0,0,32.8,18.4,262.6,1006.5,47.5,6,262.6,22.6,9,,2015-09-26 5:57:56,2015-09-26 18:02:40,0.44,Partially cloudy,Partly cloudy throughout the day.,â›…,4.33E+10
Chennai,27/9/15,35.1,27.1,30.1,43.7,30.8,36.8,25.7,78.1,0,0,0,,0,0,24.1,18.4,261.7,1006.6,51.9,5.6,232.3,20,8,,2015-09-27 5:57:57,2015-09-27 18:01:58,0.47,Partially cloudy,Partly cloudy throughout the day.,â›…,"43279099999,remote"
Chennai,28/9/15,34.1,27.1,29.6,40.7,30.2,34.9,24.8,76.1,1,100,4.17,rain,0,0,29.2,18.4,96.2,1006.4,71.3,5.4,234.7,20.1,8,,2015-09-28 5:57:59,2015-09-28 18:01:16,0.5,"Rain, Partially cloudy",Partly cloudy throughout the day with afternoon rain.,ğŸŒ§ï¸,4.33E+10
Chennai,29/9/15,32.1,26.1,28.1,40.8,26.1,31.9,24.7,81.9,0,0,0,,0,0,19.4,18.4,136.8,1007,76.7,5.7,120.1,10.3,6,,2015-09-29 5:58:00,2015-09-29 18:00:34,0.54,Partially cloudy,Partly cloudy throughout the day.,â›…,4.33E+10
Chennai,30/9/15,34.1,26.1,29.3,40.7,26.1,33.8,24.9,78.2,0.1,100,4.17,rain,0,0,21.6,18.4,103.6,1008.6,76.7,5.4,217,18.6,7,,2015-09-30 5:58:02,2015-09-30 17:59:52,0.57,"Rain, Partially cloudy",Partly cloudy throughout the day with early morning rain.,ğŸŒ§ï¸,4.33E+10
Chennai,01/10/15,31.1,26.1,28.6,39.3,26.1,33.6,25.5,83.5,1.6,100,12.5,rain,0,0,30.6,18.4,167.3,1009.8,78.3,5.5,194,16.7,8,,2015-10-01 5:58:04,2015-10-01 17:59:11,0.61,"Rain, Partially cloudy",Partly cloudy throughout the day with a chance of rain throughout the day.,ğŸŒ§ï¸,4.33E+10
Chennai,02/10/15,35.1,26.1,30.3,43.5,26.1,36.3,25.2,75.4,13,100,4.17,rain,0,0,29.2,22.3,213.9,1010.2,60.8,6.4,222.7,19.1,8,,2015-10-02 5:58:06,2015-10-02 17:58:30,0.64,"Rain, Partially cloudy",Partly cloudy throughout the day with late afternoon rain.,ğŸŒ§ï¸,4.33E+10
Chennai,03/10/15,32.1,25.1,28,40.8,25.1,32.2,25.3,86,12,100,8.33,rain,0,0,32.8,16.6,259.2,1010.2,82.5,5.8,167.8,14.5,6,,2015-10-03 5:58:08,2015-10-03 17:57:49,0.67,"Rain, Partially cloudy",Partly cloudy throughout the day with early morning rain.,ğŸŒ§ï¸,4.33E+10
Chennai,04/10/15,35.1,26.1,29.8,43.7,26.1,35.6,25.6,79.1,0.4,100,4.17,rain,0,0,27.7,25.9,263.4,1009.2,60.8,5.7,175.6,15.1,6,,2015-10-04 5:58:11,2015-10-04 17:57:09,0.71,"Rain, Partially cloudy",Partly cloudy throughout the day with late afternoon rain.,ğŸŒ§ï¸,4.33E+10
Chennai,05/10/15,33.1,25.1,27.4,42.3,25.1,30.5,25,87.5,15.6,100,4.17,rain,0,0,21.2,24.1,251.7,1009,73.8,4.9,159.1,13.6,5,,2015-10-05 5:58:14,2015-10-05 17:56:29,0.75,"Rain, Partially cloudy",Partly cloudy throughout the day with early morning rain.,ğŸŒ§ï¸,4.33E+10
Chennai,06/10/15,35.1,25.1,29.5,42.1,25.1,34.1,24.8,77.4,0,0,0,,0,0,20.5,14.8,216.9,1007.6,43.9,6.7,239.6,20.6,9,,2015-10-06 5:58:17,2015-10-06 17:55:49,0.77,Partially cloudy,Partly cloudy throughout the day.,â›…,"43279099999,remote"
Chennai,07/10/15,35.1,26.1,29.5,42.3,26.1,34.2,25.1,78.5,13,100,8.33,rain,0,0,25.9,18.4,219.2,1007.8,60.3,6.8,238.2,20.5,9,,2015-10-07 5:58:21,2015-10-07 17:55:10,0.81,"Rain, Partially cloudy",Partly cloudy throughout the day with late afternoon rain.,ğŸŒ§ï¸,"43279099999,remote"
Chennai,08/10/15,35.1,26.1,29.4,44,26.1,34.5,25.6,81.5,15,100,8.33,rain,0,0,24.5,16.6,205.8,1008.2,71.7,5.5,224.1,19.3,8,,2015-10-08 5:58:25,2015-10-08 17:54:31,0.84,"Rain, Partially cloudy",Partly cloudy throughout the day with early morning rain.,ğŸŒ§ï¸,4.33E+10
Chennai,09/10/15,34.1,26.1,29.6,42.5,26.1,36,25.8,80.8,0,0,0,,0,0,25.2,14.8,210.3,1007.9,88.3,6.1,200.7,17.2,7,,2015-10-09 5:58:30,2015-10-09 17:53:53,0.87,Partially cloudy,Partly cloudy throughout the day.,â›…,4.33E+10
Chennai,10/10/15,35.1,26.1,30.1,43.5,26.1,36.2,25.5,77.9,0.2,100,4.17,rain,0,0,29.9,18.4,215.9,1008.6,67.5,6.1,213.5,18.5,8,,2015-10-10 5:58:34,2015-10-10 17:53:15,0.91,"Rain, Partially cloudy",Partly cloudy throughout the day with early morning rain.,ğŸŒ§ï¸,4.33E+10
Chennai,11/10/15,32.1,25.1,28.8,39,25.1,33.3,24.8,79.7,19,100,4.17,rain,0,0,27.4,22.3,226.2,1010.1,66.7,6.1,212.8,18.2,8,,2015-10-11 5:58:40,2015-10-11 17:52:38,0.94,"Rain, Partially cloudy",Partly cloudy throughout the day with early morning rain.,ğŸŒ§ï¸,4.33E+10
Chennai,12/10/15,35.1,27.1,30.4,43.5,31.4,37.1,25.7,77.1,0,0,0,,0,0,23.8,20.5,209.3,1010.7,50,6,251.1,21.8,8,,2015-10-12 5:58:45,2015-10-12 17:52:01,0.98,Partially cloudy,Partly cloudy throughout the day.,â›…,4.33E+10
Chennai,13/10/15,34.1,26.1,29.6,43.7,26.1,34.7,25.2,78.2,0,0,0,,0,0,22.7,14.8,159.1,1010.7,40.8,6.2,252.6,21.7,9,,2015-10-13 5:58:51,2015-10-13 17:51:25,0,Partially cloudy,Partly cloudy throughout the day.,â›…,4.33E+10
Chennai,14/10/15,35.1,25.1,29.8,42,25.1,34.2,24.7,76.2,0,0,0,,0,0,20.9,16.6,163,1011,32.5,5.6,256.1,22.2,9,,2015-10-14 5:58:58,2015-10-14 17:50:49,0.04,Partially cloudy,Partly cloudy throughout the day.,â›…,4.33E+10
Chennai,15/10/15,34.1,25.1,29.4,43.7,25.1,34.3,25,78.1,0,0,0,,0,0,22.3,18.4,145.5,1010.9,31.7,5.9,253.6,21.9,9,,2015-10-15 5:59:05,2015-10-15 17:50:14,0.08,Partially cloudy,Partly cloudy throughout the day.,â›…,4.33E+10
Chennai,16/10/15,33.1,25.1,29,39.4,25.1,32.8,24.1,76,0,0,0,,0,0,25.6,18.4,76.6,1011.1,31.7,5.5,240.4,20.6,8,,2015-10-16 5:59:12,2015-10-16 17:49:40,0.11,Partially cloudy,Partly cloudy throughout the day.,â›…,4.33E+10
Chennai,17/10/15,34.1,25.1,29.1,42.1,25.1,33.2,24.5,77.3,0,0,0,,0,0,27,18.4,62.2,1011.6,24.2,5.7,213.2,18.4,7,,2015-10-17 5:59:20,2015-10-17 17:49:07,0.15,Partially cloudy,Partly cloudy throughout the day.,â›…,4.33E+10
Chennai,18/10/15,34.1,26.1,29.6,40.7,26.1,34.3,24.8,76.7,0,0,0,,0,0,29.5,18.4,57.6,1012,37.1,5.2,217.1,18.7,9,,2015-10-18 5:59:28,2015-10-18 17:48:34,0.18,Partially cloudy,Partly cloudy throughout the day.,â›…,4.33E+10
Chennai,19/10/15,33.1,27.1,29.6,42.3,30.8,36,25.9,81.1,3,100,8.33,rain,0,0,28.4,22.3,65.4,1011.6,45,5.5,231.7,20.1,8,,2015-10-19 5:59:37,2015-10-19 17:48:01,0.22,"Rain, Partially cloudy",Partly cloudy throughout the day with early morning rain.,ğŸŒ§ï¸,4.33E+10
Chennai,20/10/15,34.1,26.1,29.8,42.1,26.1,34.8,25.1,77.2,0,0,0,,0,0,23,22.3,83.1,1010.2,37.5,5.8,225.8,19.5,8,,2015-10-20 5:59:47,2015-10-20 17:47:30,0.25,Partially cloudy,Partly cloudy throughout the day.,â›…,4.33E+10
Chennai,21/10/15,34.1,27.1,29.5,40.7,30.8,34.5,24.5,75.4,0,0,0,,0,0,24.1,18.4,72.8,1009.8,35.8,6,240.8,20.6,8,,2015-10-21 5:59:57,2015-10-21 17:46:59,0.25,Partially cloudy,Partly cloudy throughout the day.,â›…,"43279099999,remote"
Chennai,22/10/15,33.1,25.1,28.5,38.2,25.1,30.5,22.6,72.6,0,0,0,,0,0,27,20.5,44.9,1010.8,33.3,5.7,267,23.1,9,,2015-10-22 6:00:07,2015-10-22 17:46:29,0.32,Partially cloudy,Partly cloudy throughout the day.,â›…,4.33E+10
Chennai,23/10/15,30.1,24.1,26.3,35.2,24.1,27.4,23.5,84.9,5,100,8.33,rain,0,0,30.2,22.3,62.4,1010.6,67.9,4,190.4,16.4,8,,2015-10-23 6:00:19,2015-10-23 17:46:00,0.35,"Rain, Partially cloudy",Partly cloudy throughout the day with afternoon rain.,ğŸŒ§ï¸,4.33E+10
Chennai,24/10/15,32.1,24.1,27.6,36.9,24.1,29.7,23.2,78.9,0,0,0,,0,0,30.2,14.8,52,1010.3,45.8,5.2,253.6,21.7,9,,2015-10-24 6:00:30,2015-10-24 17:45:31,0.39,Partially cloudy,Partly cloudy throughout the day.,â›…,4.33E+10
Chennai,25/10/15,33.1,25.1,28.4,39.4,25.1,31.5,23.7,76.8,0,0,0,,0,0,33.1,20.5,41.9,1011.1,41.7,5.4,195.1,17,7,,2015-10-25 6:00:43,2015-10-25 17:45:04,0.42,Partially cloudy,Partly cloudy throughout the day.,â›…,4.33E+10
Chennai,26/10/15,33.1,25.1,28.4,38.2,25.1,31.3,23.8,77.5,0.4,100,4.17,rain,0,0,35.6,22.3,51.4,1011.6,46.6,6,236,20.2,9,,2015-10-26 6:00:55,2015-10-26 17:44:37,0.46,"Rain, Partially cloudy",Partly cloudy throughout the day with afternoon rain.,ğŸŒ§ï¸,"43279099999,remote"
Chennai,27/10/15,33.1,26.1,28.8,39.4,26.1,32.5,24.2,77.3,0.5,100,4.17,rain,0,0,34.6,22.3,22.1,1011.1,70.8,5.4,163,14,7,,2015-10-27 6:01:09,2015-10-27 17:44:11,0.5,"Rain, Partially cloudy",Partly cloudy throughout the day with late afternoon rain.,ğŸŒ§ï¸,4.33E+10
Chennai,28/10/15,32.1,23.1,27.4,40.8,23.1,30.5,25,87.7,27.5,100,12.5,rain,0,0,27.7,14.8,89.7,1011.2,80.8,4.2,152.2,13.1,6,,2015-10-28 6:01:23,2015-10-28 17:43:46,0.53,"Rain, Partially cloudy",Partly cloudy throughout the day with rain.,ğŸŒ§ï¸,"43279099999,remote"
Chennai,29/10/15,30.1,25.1,27.3,36.3,25.1,30.4,25.1,88.3,13,100,4.17,rain,0,0,33.8,14.8,19.7,1010.4,73.3,4.9,154.7,13.3,6,,2015-10-29 6:01:38,2015-10-29 17:43:22,0.56,"Rain, Partially cloudy",Partly cloudy throughout the day with afternoon rain.,ğŸŒ§ï¸,4.33E+10
Chennai,30/10/15,31.1,25.1,26.9,37.9,25.1,29.2,25.4,91.9,23,100,8.33,rain,0,0,22.7,14.8,223.5,1009.3,57.5,4.5,92.1,7.9,5,,2015-10-30 6:01:53,2015-10-30 17:42:59,0.59,"Rain, Partially cloudy",Partly cloudy throughout the day with afternoon rain.,ğŸŒ§ï¸,4.33E+10
Chennai,31/10/15,31.1,24.1,26.9,37.9,24.1,28.9,25.3,91.4,10,100,4.17,rain,0,0,15.1,18.4,203.1,1009.7,81.3,4.8,69.8,6.2,3,,2015-10-31 6:02:09,2015-10-31 17:42:37,0.62,"Rain, Partially cloudy",Partly cloudy throughout the day with late afternoon rain.,ğŸŒ§ï¸,4.33E+10
Chennai,01/11/15,32.1,25.1,26.9,40.8,25.1,28.7,25.1,90.8,88,100,8.33,rain,0,0,26.3,11.2,323.6,1010.7,75.4,4.6,107.6,9.4,7,,2015-11-01 6:02:26,2015-11-01 17:42:15,0.66,"Rain, Partially cloudy",Partly cloudy throughout the day with afternoon rain.,ğŸŒ§ï¸,4.33E+10
Chennai,02/11/15,32.1,24.1,27.9,39.3,24.1,31.7,24.9,84.2,12,100,8.33,rain,0,0,18.4,14.8,218.1,1011.7,76.3,5.5,112,9.6,5,,2015-11-02 6:02:43,2015-11-02 17:41:55,0.69,"Rain, Partially cloudy",Partly cloudy throughout the day with rain clearing later.,ğŸŒ§ï¸,4.33E+10
Chennai,03/11/15,32.1,26.1,27.7,40.8,26.1,30.7,25.6,89,0.4,100,8.33,rain,0,0,18.4,20.5,134.4,1011.8,76.8,4.7,192.3,16.6,8,,2015-11-03 6:03:01,2015-11-03 17:41:36,0.75,"Rain, Partially cloudy",Partly cloudy throughout the day with late afternoon rain.,ğŸŒ§ï¸,"43279099999,remote"
Chennai,04/11/15,32.1,25.1,28.2,39.3,25.1,32.5,25.5,86.1,3,100,4.17,rain,0,0,25.9,18.4,35.2,1010.9,65,4.9,203.5,17.6,8,,2015-11-04 6:03:19,2015-11-04 17:41:18,0.75,"Rain, Partially cloudy",Partly cloudy throughout the day with afternoon rain.,ğŸŒ§ï¸,4.33E+10
Chennai,05/11/15,30.1,26.1,27.8,39,26.1,32.2,26,90.6,0.2,100,4.17,rain,0,0,25.9,13,20,1010.5,65,4.9,191.5,16.5,7,,2015-11-05 6:03:38,2015-11-05 17:41:01,0.79,"Rain, Partially cloudy",Partly cloudy throughout the day with morning rain.,ğŸŒ§ï¸,4.33E+10
Chennai,06/11/15,32.1,26.1,28.6,40.8,26.1,33.3,25.5,83.8,0,0,0,,0,0,34.9,22.3,29.2,1009.5,49.2,6,202.3,17.5,8,,2015-11-06 6:03:58,2015-11-06 17:40:45,0.82,Partially cloudy,Partly cloudy throughout the day.,â›…,4.33E+10
Chennai,07/11/15,30.1,25.1,27.1,36.3,25.1,29.6,25.3,90.3,0.549,100,4.17,rain,0,0,32.8,15.1,9.4,1010.4,67,4.9,158.8,13.8,6,,2015-11-07 6:04:18,2015-11-07 17:40:30,0.85,"Rain, Partially cloudy",Partly cloudy throughout the day with morning rain.,ğŸŒ§ï¸,"43279099999,43278099999,remote"
Chennai,08/11/15,27.1,25.1,25.8,30.8,25.1,26.1,25.1,96.1,175,100,45.83,rain,0,0,54.7,24.1,14.5,1009.5,88.3,3.2,52.6,4.4,3,,2015-11-08 6:04:40,2015-11-08 17:40:16,0.89,"Rain, Partially cloudy",Partly cloudy throughout the day with a chance of rain throughout the day.,ğŸŒ§ï¸,"43279099999,remote"
Chennai,09/11/15,27.1,25.1,26.3,31.4,25.1,27.2,24.9,92.5,192,100,25,rain,0,0,76,37.1,52.1,1004.4,94.2,2.5,42.8,3.7,2,,2015-11-09 6:05:01,2015-11-09 17:40:03,0.92,"Rain, Overcast",Cloudy skies throughout the day with a chance of rain throughout the day.,ğŸŒ§ï¸,"43279099999,remote"
Chennai,10/11/15,29.1,25.1,26.2,34.7,25.1,27.4,24.1,88.5,28,100,12.5,rain,0,0,58,25.9,130.8,1004.7,90.4,4.1,143.8,12.4,6,,2015-11-10 6:05:23,2015-11-10 17:39:51,0.95,"Rain, Overcast",Cloudy skies throughout the day with rain.,ğŸŒ§ï¸,"43279099999,remote"
Chennai,11/11/15,29.1,24.1,26.7,34.7,24.1,29.4,25.2,91.7,74,100,8.33,rain,0,0,32,16.6,70.5,1009.2,91.5,3.4,131,11.2,5,,2015-11-11 6:05:46,2015-11-11 17:39:40,0,"Rain, Overcast",Cloudy skies throughout the day with rain.,ğŸŒ§ï¸,"43279099999,remote"
Chennai,12/11/15,31.1,24.1,27.4,39.3,24.1,30.8,25.5,90.2,31,100,8.33,rain,0,0,29.9,18.4,31,1011,81.7,4.8,150.7,13,5,,2015-11-12 6:06:10,2015-11-12 17:39:31,0.02,"Rain, Partially cloudy",Partly cloudy throughout the day with late afternoon rain.,ğŸŒ§ï¸,4.33E+10
Chennai,13/11/15,26.1,25.1,25.4,26.1,25.1,25.4,24.9,97.3,122,100,20.83,rain,0,0,40.3,16.6,358,1011.9,97.5,2.2,61.2,5.3,4,,2015-11-13 6:06:34,2015-11-13 17:39:22,0.05,"Rain, Overcast",Cloudy skies throughout the day with a chance of rain throughout the day.,ğŸŒ§ï¸,"43279099999,remote"
Chennai,14/11/15,29.1,24.1,26.5,32.9,24.1,28.2,23.9,85.8,0,0,0,,0,0,41,18.4,4,1009.8,90.4,3.7,134.6,11.6,6,,2015-11-14 6:06:59,2015-11-14 17:39:15,0.09,Overcast,Cloudy skies throughout the day.,â˜ï¸,4.33E+10
Chennai,15/11/15,26.5,24,25.1,26.5,24,25.1,24.3,95.5,45.3,100,95.83,rain,0,0,38.9,19.8,359.5,1008.7,100,1.5,45,3.9,2,,2015-11-15 6:07:24,2015-11-15 17:39:09,0.12,"Rain, Overcast",Cloudy skies throughout the day with a chance of rain throughout the day.,ğŸŒ§ï¸,"VOMM,remote"
Chennai,16/11/15,29,24,25.8,38,24,27.6,25.2,96.4,117.7,100,100,rain,0,0,47.2,27.7,30.8,1006.7,90.8,3.2,21.1,1.8,2,,2015-11-16 6:07:50,2015-11-16 17:39:04,0.16,"Rain, Overcast",Cloudy skies throughout the day with a chance of rain throughout the day.,ğŸŒ§ï¸,VOMM
Chennai,17/11/15,28,24,25.3,31.8,24,26,22.7,86.1,0.2,100,8.33,rain,0,0,33.5,13,280.5,1008,80.1,6.1,100.6,8.8,4,,2015-11-17 6:08:16,2015-11-17 17:39:00,0.19,"Rain, Partially cloudy",Partly cloudy throughout the day with afternoon rain.,ğŸŒ§ï¸,VOMM
Chennai,18/11/15,28,24,25.5,32.6,24,26.6,23.7,89.7,10.1,100,45.83,rain,0,0,17.6,13,321.4,1009,88,6.2,158.6,13.8,6,,2015-11-18 6:08:43,2015-11-18 17:38:57,0.23,"Rain, Partially cloudy",Partly cloudy throughout the day with rain.,ğŸŒ§ï¸,VOMM
Chennai,19/11/15,29,25,26.3,35.5,25,27.8,25.5,95.9,29.9,100,100,rain,0,0,24.1,13,32.9,1010.5,94,2.8,81.1,6.9,4,,2015-11-19 6:09:11,2015-11-19 17:38:55,0.25,"Rain, Overcast",Cloudy skies throughout the day with a chance of rain throughout the day.,ğŸŒ§ï¸,VOMM
Chennai,20/11/15,31,24,27.2,37.6,24,29.8,25,88.8,14.8,100,100,rain,0,0,27.7,20.5,63.4,1011.2,84.8,4.7,139.6,12.2,6,,2015-11-20 6:09:39,2015-11-20 17:38:55,0.3,"Rain, Partially cloudy",Partly cloudy throughout the day with a chance of rain throughout the day.,ğŸŒ§ï¸,VOMM
Chennai,21/11/15,31,25,27.3,37.6,25,30.3,25.5,90.1,6.4,100,87.5,rain,0,0,34.9,22.3,47.9,1011,83.4,4.1,177.3,15.3,7,,2015-11-21 6:10:07,2015-11-21 17:38:55,0.34,"Rain, Partially cloudy",Partly cloudy throughout the day with a chance of rain throughout the day.,ğŸŒ§ï¸,"VOMM,remote"
Chennai,22/11/15,30,25,27,38.7,25,29.9,25.4,91.3,19.1,100,100,rain,0,0,46.4,25.9,46.2,1011.1,79.4,4.7,114.1,9.9,4,,2015-11-22 6:10:36,2015-11-22 17:38:57,0.37,"Rain, Partially cloudy",Partly cloudy throughout the day with a chance of rain throughout the day.,ğŸŒ§ï¸,VOMM
Chennai,23/11/15,31,24,26.3,39,24,28.2,24.8,92.3,16.2,100,100,rain,0,0,37.1,18.4,68.4,1012.2,95.5,3.2,142.1,12.2,6,,2015-11-23 6:11:06,2015-11-23 17:39:00,0.41,"Rain, Overcast",Cloudy skies throughout the day with a chance of rain throughout the day.,ğŸŒ§ï¸,VOMM
Chennai,24/11/15,31,24,26.8,36.4,24,28.6,24,85.6,2,100,54.17,rain,0,0,32,18.4,30.4,1012.5,58.4,5.6,183,15.7,7,,2015-11-24 6:11:36,2015-11-24 17:39:04,0.44,"Rain, Partially cloudy",Partly cloudy throughout the day with a chance of rain throughout the day.,ğŸŒ§ï¸,VOMM
Chennai,25/11/15,31,24,27.3,34.4,24,29.5,23.4,80.8,0.8,100,16.67,rain,0,0,64.8,16.6,11,1012.1,58,4.7,196.7,17,7,,2015-11-25 6:12:06,2015-11-25 17:39:10,0.48,"Rain, Partially cloudy",Partly cloudy throughout the day with late afternoon rain.,ğŸŒ§ï¸,VOMM
Chennai,26/11/15,30,26,27.3,34,26,29.6,23.9,82.2,3.3,100,62.5,rain,0,0,33.8,18.4,26.9,1012,86.4,4.4,163.9,14.1,7,,2015-11-26 6:12:37,2015-11-26 17:39:16,0.5,"Rain, Partially cloudy",Partly cloudy throughout the day with rain.,ğŸŒ§ï¸,VOMM
Chennai,27/11/15,31,24,26.8,34.4,24,27.8,22.3,77.2,0.1,100,4.17,rain,0,0,25.2,18.4,33.6,1011,63.8,6.3,218.3,18.8,8,,2015-11-27 6:13:08,2015-11-27 17:39:23,0.54,"Rain, Partially cloudy",Partly cloudy throughout the day with early morning rain.,ğŸŒ§ï¸,"VOMM,remote"
Chennai,28/11/15,30,23,26.5,35,23,28.5,23.2,83,0.3,100,8.33,rain,0,0,32,14.8,9.6,1012.7,59.6,4.5,175.7,15.1,7,,2015-11-28 6:13:39,2015-11-28 17:39:32,0.57,"Rain, Partially cloudy",Partly cloudy throughout the day with late afternoon rain.,ğŸŒ§ï¸,VOMM
Chennai,29/11/15,31,25,27.4,37.6,25,30.2,25,87.4,17.4,100,100,rain,0,0,33.5,25.9,49.5,1013.2,85.3,3.8,140.9,12.3,6,,2015-11-29 6:14:11,2015-11-29 17:39:42,0.61,"Rain, Partially cloudy",Partly cloudy throughout the day with a chance of rain throughout the day.,ğŸŒ§ï¸,VOMM
Chennai,30/11/15,29,24,26,35.5,24,27.4,24.7,92.6,12,100,95.83,rain,0,0,34.9,18.4,22.1,1013.6,93,4,84.6,7.4,3,,2015-11-30 6:14:43,2015-11-30 17:39:53,0.64,"Rain, Overcast",Cloudy skies throughout the day with a chance of rain throughout the day.,ğŸŒ§ï¸,VOMM
Chennai,01/12/15,26,24,25.2,26,24,25.2,24.5,95.8,49.1,100,100,rain,0,0,44.3,27.7,33.2,1012.3,100,2,35.6,3,2,,2015-12-01 6:15:15,2015-12-01 17:40:04,0.67,"Rain, Overcast",Cloudy skies throughout the day with a chance of rain throughout the day.,ğŸŒ§ï¸,"VOMM,remote"
Chennai,02/12/15,27,24,25.1,30.5,24,25.3,23.8,92.9,52.2,100,91.67,rain,0,0,28.1,13.3,63.9,1012.1,99.5,3.9,24.1,2,1,,2015-12-02 6:15:47,2015-12-02 17:40:17,0.7,"Rain, Overcast",Cloudy skies throughout the day with a chance of rain throughout the day.,ğŸŒ§ï¸,"VOMM,43278099999,remote"
Chennai,03/12/15,28,23,25.1,32.6,23,25.8,23.6,91.3,24.1,100,100,rain,0,0,38.2,18.4,39.1,1011.9,95,3.7,44.1,3.7,2,,2015-12-03 6:16:20,2015-12-03 17:40:31,0.75,"Rain, Overcast",Cloudy skies throughout the day with a chance of rain throughout the day.,ğŸŒ§ï¸,"VOMM,remote"
Chennai,04/12/15,29,23,25.8,34.4,23,27.3,23.9,89.5,9.2,100,95.83,rain,0,0,49,25.9,32.5,1011.8,94.5,3.4,105.3,9.1,4,,2015-12-04 6:16:53,2015-12-04 17:40:46,0.77,"Rain, Overcast",Cloudy skies throughout the day with a chance of rain throughout the day.,ğŸŒ§ï¸,"VOMM,remote"
Chennai,05/12/15,28,24,25.5,31.8,24,26.1,23.4,88.4,10,100,95.83,rain,0,0,41,22.3,44.3,1012,89.9,4,95.6,8.3,5,,2015-12-05 6:17:26,2015-12-05 17:41:02,0.8,"Rain, Partially cloudy",Partly cloudy throughout the day with a chance of rain throughout the day.,ğŸŒ§ï¸,"VOMM,43278099999"
Chennai,06/12/15,26,24,25.4,26,24,25.4,24.1,92.4,20.9,100,100,rain,0,0,34.6,22.3,29.9,1012.6,92,3,86.2,7.4,4,,2015-12-06 6:17:59,2015-12-06 17:41:19,0.83,"Rain, Overcast",Cloudy skies throughout the day with a chance of rain throughout the day.,ğŸŒ§ï¸,VOMM
Chennai,07/12/15,30,25,26.9,35,25,28.7,23.1,80,0.5,100,16.67,rain,0,0,43.2,22.3,25.6,1012.9,74.9,4.6,184.5,15.9,7,,2015-12-07 6:18:32,2015-12-07 17:41:37,0.87,"Rain, Partially cloudy",Partly cloudy throughout the day with early morning rain.,ğŸŒ§ï¸,"VOMM,43278099999"
Chennai,08/12/15,29,24,26.1,31.9,24,26.8,22.2,79.9,1.9,100,16.67,rain,0,0,45.7,18.4,4.7,1013.6,73.8,4.9,188.1,16.3,8,,2015-12-08 6:19:05,2015-12-08 17:41:56,0.9,"Rain, Partially cloudy",Partly cloudy throughout the day with late afternoon rain.,ğŸŒ§ï¸,"VOMM,43278099999"
Chennai,09/12/15,30,24,26.4,36.1,24,29,24.4,89,6,100,8.33,rain,0,0,28.8,20.5,29.3,1013.7,94.4,4.2,94.1,8.2,4,,2015-12-09 6:19:38,2015-12-09 17:42:16,0.93,"Rain, Overcast",Cloudy skies throughout the day with rain clearing later.,ğŸŒ§ï¸,"VOMM,43278099999"
Chennai,10/12/15,30,25,27.1,34,25,28.6,23.3,80.6,1.6,100,41.67,rain,0,0,35.3,18.4,14.1,1013.7,63.2,5.6,150.5,12.9,7,,2015-12-10 6:20:11,2015-12-10 17:42:37,0.96,"Rain, Partially cloudy",Partly cloudy throughout the day with a chance of rain throughout the day.,ğŸŒ§ï¸,"VOMM,43278099999"
Chennai,11/12/15,32,24,27.3,42.1,24,30.5,24.3,84.1,1.5,100,45.83,rain,0,0,72.4,13,78.4,1012,45.8,5.5,143.7,12.4,6,,2015-12-11 6:20:44,2015-12-11 17:42:59,0,"Rain, Partially cloudy",Partly cloudy throughout the day with a chance of rain throughout the day.,ğŸŒ§ï¸,"VOMM,43278099999"
Chennai,12/12/15,32,24,27.7,39.1,24,30.4,23.7,79.9,0,0,0,,0,0,48.2,13,90.4,1011.5,45.4,6.1,185,15.9,7,,2015-12-12 6:21:17,2015-12-12 17:43:21,0.03,Partially cloudy,Partly cloudy throughout the day.,â›…,"VOMM,43278099999"
Chennai,13/12/15,32,23,27,36.7,23,28.4,22.3,76.8,0,0,0,,0,0,17.6,11.2,80.8,1011.7,33.5,7.1,215.5,18.6,8,,2015-12-13 6:21:50,2015-12-13 17:43:45,0.07,Partially cloudy,Partly cloudy throughout the day.,â›…,"VOMM,43278099999"
Chennai,14/12/15,30,24,26.4,35,24,28.1,23.2,82.8,0,0,0,,0,0,40.7,13,57.3,1012.5,38.1,6.1,164.7,14.4,6,,2015-12-14 6:22:23,2015-12-14 17:44:09,0.1,Partially cloudy,Partly cloudy throughout the day.,â›…,"VOMM,43278099999"
Chennai,15/12/15,31,22,25.9,35.4,22,27.1,21.7,79.1,0,0,0,,0,0,20.5,11.2,75.6,1012.6,33.5,5.4,195.5,16.9,7,,2015-12-15 6:22:55,2015-12-15 17:44:34,0.14,Partially cloudy,Partly cloudy throughout the day.,â›…,"VOMM,43278099999"
Chennai,16/12/15,32,21,25.9,35.7,21,27,20.8,75,0,0,0,,0,0,19.4,11.2,73.3,1014,38,6.4,193.7,16.8,7,,2015-12-16 6:23:27,2015-12-16 17:44:59,0.17,Partially cloudy,Partly cloudy throughout the day.,â›…,"VOMM,43278099999"
Chennai,17/12/15,32,22.9,26.7,35.7,22.9,28.4,22.1,76.5,0,0,0,,0,0,23.4,14.8,78,1013,37.5,6,173.4,15,7,,2015-12-17 6:23:59,2015-12-17 17:45:26,0.21,Partially cloudy,Partly cloudy throughout the day.,â›…,"VOMM,43278099999"
Chennai,18/12/15,32,23,27.1,37.8,23,29.4,23,78.9,0,0,0,,0,0,23.8,13,81.5,1013.5,37.7,6,199.5,17.3,7,,2015-12-18 6:24:31,2015-12-18 17:45:53,0.25,Partially cloudy,Partly cloudy throughout the day.,â›…,"VOMM,43278099999"
Chennai,19/12/15,32,24,27.6,37.8,24,30.2,23.5,79,0.4,100,16.67,rain,0,0,28.4,18.4,74.3,1015.2,35.1,6.1,194.9,16.7,8,,2015-12-19 6:25:02,2015-12-19 17:46:21,0.28,"Rain, Partially cloudy",Partly cloudy throughout the day with rain in the morning and afternoon.,ğŸŒ§ï¸,"VOMM,43278099999"
Chennai,20/12/15,32,24,27.3,36.7,24,29.1,22.7,77.2,0,0,0,,0,0,24.5,14.8,64.4,1015.4,27.3,6.3,200.1,17.3,7,,2015-12-20 6:25:33,2015-12-20 17:46:49,0.31,Partially cloudy,Becoming cloudy in the afternoon.,â›…,"VOMM,43278099999,remote"
Chennai,21/12/15,34,22.5,27.1,36.4,22.5,28.4,21.3,72.9,0,0,0,,0,0,15.5,11.2,106.5,1013.7,26.6,6.5,215.7,18.7,8,,2015-12-21 6:26:04,2015-12-21 17:47:18,0.35,Partially cloudy,Partly cloudy throughout the day.,â›…,"VOMM,43278099999"
Chennai,22/12/15,32,23,27.2,36.7,23,29.1,22.6,76.8,0.2,100,8.33,rain,0,0,20.9,11.2,88,1015.4,27.5,6.1,203,17.5,7,,2015-12-22 6:26:34,2015-12-22 17:47:48,0.39,"Rain, Partially cloudy",Partly cloudy throughout the day with rain in the morning and afternoon.,ğŸŒ§ï¸,"VOMM,43278099999"
Chennai,23/12/15,32,25,27.7,36.7,25,29.8,22.8,75.4,0,0,0,,0,0,21.2,13,65.8,1015.6,36.8,5.9,200.1,17.1,7,,2015-12-23 6:27:03,2015-12-23 17:48:18,0.42,Partially cloudy,Partly cloudy throughout the day.,â›…,"VOMM,43278099999"
Chennai,24/12/15,32,23.9,27.2,36.7,23.9,28.9,22.4,75.8,0,0,0,,0,0,23.4,18.4,66.4,1014.7,30.8,5.4,208.1,17.8,7,,2015-12-24 6:27:32,2015-12-24 17:48:49,0.46,Partially cloudy,Partly cloudy throughout the day.,â›…,"VOMM,43278099999"
Chennai,25/12/15,32,23,26.9,34.8,23,28.2,21.8,74.7,0.1,100,4.17,rain,0,0,28.8,14.8,46.7,1014.8,38.2,5.4,213.7,18.2,8,,2015-12-25 6:28:01,2015-12-25 17:49:20,0.5,"Rain, Partially cloudy",Partly cloudy throughout the day with morning rain.,ğŸŒ§ï¸,"VOMM,43278099999"
Chennai,26/12/15,31,24,26.1,33.2,24,26.9,21.7,78.3,1.7,100,50,rain,0,0,42.8,20.5,2.6,1015.2,45.9,4.8,181.1,15.7,7,,2015-12-26 6:28:29,2015-12-26 17:49:52,0.53,"Rain, Partially cloudy",Partly cloudy throughout the day with rain.,ğŸŒ§ï¸,"VOMM,43278099999"
Chennai,27/12/15,31,23,26.5,35.4,23,27.9,22.1,77.4,0.9,100,29.17,rain,0,0,49.3,27.7,53.6,1016.1,55.4,4.4,200.8,17.2,7,,2015-12-27 6:28:56,2015-12-27 17:50:24,0.56,"Rain, Partially cloudy",Partly cloudy throughout the day with rain clearing later.,ğŸŒ§ï¸,"VOMM,43278099999"
Chennai,28/12/15,31,24,26.7,34.4,24,27.8,21.4,73.4,0,0,0,,0,0,37.4,22.3,20.8,1017.9,53,5.4,195.8,16.9,8,,2015-12-28 6:29:23,2015-12-28 17:50:56,0.59,Partially cloudy,Partly cloudy throughout the day.,â›…,"VOMM,43278099999"
Chennai,29/12/15,31,23,26.3,33.6,23,27.3,20.7,72.2,0,0,0,,0,0,35.3,20.5,14.6,1016.7,39.3,6,216.3,18.7,8,,2015-12-29 6:29:49,2015-12-29 17:51:29,0.62,Partially cloudy,Partly cloudy throughout the day.,â›…,"VOMM,43278099999"
Chennai,30/12/15,31,21,25.8,33.6,21,26.6,20.5,74.2,0,0,0,,0,0,30.2,18.4,38.3,1015.5,35.7,6,215.2,18.6,8,,2015-12-30 6:30:14,2015-12-30 17:52:02,0.65,Partially cloudy,Partly cloudy throughout the day.,â›…,"VOMM,43278099999"
Chennai,31/12/15,31,21,26,32.9,21,26.8,20.1,71.3,0,0,0,,0,0,35.6,22.3,37,1017,40.5,5.7,209.1,18.1,8,,2015-12-31 6:30:39,2015-12-31 17:52:35,0.69,Partially cloudy,Partly cloudy throughout the day.,â›…,"VOMM,43278099999"
Chennai,01/1/16,30,23,26.6,31.9,23,27.4,20,68,0,0,0,,0,0,40.3,22.3,29.9,1016.9,55.2,6,195,17,8,,2016-01-01 6:31:03,2016-01-01 17:53:09,0.72,Partially cloudy,Partly cloudy throughout the day.,â›…,"VOMM,43279099999,43278099999"
Chennai,02/1/16,31,22,25.9,33.7,22,26.7,20.3,72.4,0,0,0,,0,0,33.8,22.3,19,1016.8,35.6,5.1,215,18.7,8,,2016-01-02 6:31:26,2016-01-02 17:53:42,0.75,Partially cloudy,Partly cloudy throughout the day.,â›…,"VOMM,43279099999,43278099999"
Chennai,03/1/16,32,21,26,34.9,21,27.1,20.8,74.5,0,0,0,,0,0,23.4,13,54.3,1015.6,23.5,5.5,235.5,20.3,8,,2016-01-03 6:31:48,2016-01-03 17:54:16,0.78,Partially cloudy,Partly cloudy throughout the day.,â›…,"VOMM,43279099999,43278099999"
Chennai,04/1/16,32,22,26.2,34.2,22,27.1,20.3,71.6,0,0,0,,0,0,28.8,18.4,45.5,1015.5,28.6,5.7,239.4,20.5,8,,2016-01-04 6:32:10,2016-01-04 17:54:50,0.81,Partially cloudy,Partly cloudy throughout the day.,â›…,"VOMM,43279099999,43278099999"
Chennai,05/1/16,31,22,26,33,22,26.7,19.9,70.8,0,0,0,,0,0,29.9,18.4,42.5,1014.8,38.8,5.8,217.4,18.7,7,,2016-01-05 6:32:30,2016-01-05 17:55:24,0.85,Partially cloudy,Partly cloudy throughout the day.,â›…,"VOMM,43279099999,43278099999"
Chennai,06/1/16,31,22,26.3,32.4,22,26.9,19.5,67.7,0,0,0,,0,0,33.1,22.3,40.1,1014.9,34.1,5.7,199.6,17.1,7,,2016-01-06 6:32:50,2016-01-06 17:55:58,0.88,Partially cloudy,Partly cloudy throughout the day.,â›…,"VOMM,43279099999,43278099999"
Chennai,07/1/16,30.1,22,26.1,31.9,22,26.7,19.3,67.3,0,0,0,,0,0,33.8,22.3,51.7,1015.5,36,6.1,218.6,19,8,,2016-01-07 6:33:09,2016-01-07 17:56:32,0.91,Partially cloudy,Partly cloudy throughout the day.,â›…,"VOMM,43279099999,43278099999"
Chennai,08/1/16,31,23,26,32.4,23,26.6,19.3,67.8,0,0,0,,0,0,37.1,18.4,21.5,1015.6,37.6,5.8,214.6,18.5,7,,2016-01-08 6:33:27,2016-01-08 17:57:06,0.94,Partially cloudy,Partly cloudy throughout the day.,â›…,"VOMM,43279099999,43278099999"
Chennai,09/1/16,30,21.8,25.3,30.8,21.8,25.7,19.1,70,0,0,0,,0,0,24.1,14.8,58.1,1013.7,32.7,5.7,224.1,19.4,8,,2016-01-09 6:33:43,2016-01-09 17:57:41,0.97,Partially cloudy,Partly cloudy throughout the day.,â›…,"VOMM,43279099999,43278099999"
Chennai,10/1/16,30,20,25,30.4,20,25.3,18.1,67.6,0,0,0,,0,0,23.4,13,67.1,1014.8,27.1,6.1,232.3,20.1,8,,2016-01-10 6:33:59,2016-01-10 17:58:15,0,Partially cloudy,Partly cloudy throughout the day.,â›…,"VOMM,43279099999,43278099999"
Chennai,11/1/16,31,21,25.1,32.4,21,25.6,18.5,68.4,0,0,0,,0,0,25.2,14.8,63.5,1015.1,28.4,6.2,231.5,19.9,8,,2016-01-11 6:34:14,2016-01-11 17:58:48,0.04,Partially cloudy,Partly cloudy throughout the day.,â›…,"VOMM,43279099999,43278099999"
Chennai,12/1/16,30,21,25,30.8,21,25.2,18.3,68.2,0,0,0,,0,0,24.5,14.8,56.3,1013.5,25.4,5.4,234.4,20.2,8,,2016-01-12 6:34:28,2016-01-12 17:59:22,0.08,Partially cloudy,Partly cloudy throughout the day.,â›…,"VOMM,43279099999,43278099999"
Chennai,13/1/16,31,20,25.1,31.9,20,25.4,18.6,69.2,0,0,0,,0,0,22,18.4,74.1,1012.8,30.4,5.2,222.5,19.2,7,,2016-01-13 6:34:41,2016-01-13 17:59:56,0.11,Partially cloudy,Partly cloudy throughout the day.,â›…,"VOMM,43279099999,43278099999"
Chennai,14/1/16,31,21,25.2,31.9,21,25.6,18.2,66.9,0,0,0,,0,0,28.1,18.4,54.3,1013,25.2,4.6,235.9,20.2,8,,2016-01-14 6:34:53,2016-01-14 18:00:29,0.15,Partially cloudy,Partly cloudy throughout the day.,â›…,"VOMM,43279099999,43278099999"
Chennai,15/1/16,31,20,25.5,32.4,20,25.9,18.1,64.8,0,0,0,,0,0,26.3,16.6,65.7,1012.4,32.5,6,199,17.1,7,,2016-01-15 6:35:04,2016-01-15 18:01:02,0.19,Partially cloudy,Partly cloudy throughout the day.,â›…,"VOMM,43279099999,43278099999"
Chennai,16/1/16,31,20,24.9,31.9,20,25.2,17.9,66.8,0,0,0,,0,0,24.5,14.8,54.1,1011.8,21.7,5.9,234.5,20.1,8,,2016-01-16 6:35:14,2016-01-16 18:01:35,0.22,Partially cloudy,Partly cloudy throughout the day.,â›…,"VOMM,43279099999,43278099999"
Chennai,17/1/16,30,21,24.8,31.3,21,25.1,18.6,70.1,0,0,0,,0,0,24.5,11.2,58.4,1011.7,31.6,5.9,227.3,19.5,8,,2016-01-17 6:35:23,2016-01-17 18:02:08,0.25,Partially cloudy,Partly cloudy throughout the day.,â›…,"VOMM,43279099999,43278099999"
Chennai,18/1/16,31,22,26.1,33,22,27,19.7,69.2,0,0,0,,0,0,25.9,18.4,83.9,1010.9,38.2,6.2,189.2,16.2,6,,2016-01-18 6:35:30,2016-01-18 18:02:40,0.29,Partially cloudy,Partly cloudy throughout the day.,â›…,"VOMM,43279099999,43278099999"
Chennai,19/1/16,31,23,27.2,34.6,23,28.8,21,69.6,0,0,0,,0,0,28.1,14.8,98.4,1010.9,48.3,5.9,193.9,16.7,7,,2016-01-19 6:35:37,2016-01-19 18:03:12,0.33,Partially cloudy,Partly cloudy throughout the day.,â›…,"VOMM,43279099999,43278099999"
Chennai,20/1/16,30,25,27.5,34.1,25,29.5,22.2,73.3,0,0,0,,0,0,17.3,13,80.8,1011.7,66.3,5.1,71,6.1,3,,2016-01-20 6:35:42,2016-01-20 18:03:44,0.36,Partially cloudy,Partly cloudy throughout the day.,â›…,"VOMM,43279099999,43278099999"
Chennai,21/1/16,32,25.6,28,35.8,25.6,29.7,21.8,70.2,0,0,0,,0,0,28.4,14.8,63.8,1012.6,50.8,5,143.5,12.3,6,,2016-01-21 6:35:47,2016-01-21 18:04:15,0.4,Partially cloudy,Partly cloudy throughout the day.,â›…,"VOMM,43279099999,43278099999"
Chennai,22/1/16,30,24,26.9,35.7,24,28.9,22.8,78.5,0,0,0,,0,0,28.4,14.8,45.9,1013.4,58.5,4.4,164.5,14.1,7,,2016-01-22 6:35:50,2016-01-22 18:04:46,0.44,Partially cloudy,Partly cloudy throughout the day.,â›…,"VOMM,43279099999,43278099999"
Chennai,23/1/16,30,25,27,34.1,25,28.6,22.3,76.2,1,100,4.17,rain,0,0,33.5,22.3,39.2,1014.3,75,5.2,185.2,16,7,,2016-01-23 6:35:52,2016-01-23 18:05:16,0.47,"Rain, Partially cloudy",Partly cloudy throughout the day with early morning rain.,ğŸŒ§ï¸,"VOMM,43279099999,43278099999"
Chennai,24/1/16,30,25,27.1,33.3,25,28.6,22,73.9,0,0,0,,0,0,40.7,22.3,54.3,1014.7,61,5.7,198.9,17.2,7,,2016-01-24 6:35:53,2016-01-24 18:05:46,0.5,Partially cloudy,Partly cloudy throughout the day.,â›…,"VOMM,43279099999,43278099999"
Chennai,25/1/16,31,23,26.6,34.6,23,27.5,20.8,71.5,0,0,0,,0,0,26.6,18.4,72.4,1013.6,45,5.8,216.4,18.8,8,,2016-01-25 6:35:53,2016-01-25 18:06:16,0.54,Partially cloudy,Partly cloudy throughout the day.,â›…,"VOMM,43279099999,43278099999"
Chennai,26/1/16,31,22,26.3,33.7,22,27.4,20.6,71.7,0,0,0,,0,0,25.2,14.8,84.7,1013.1,30.7,5.1,218.1,18.8,8,,2016-01-26 6:35:52,2016-01-26 18:06:45,0.57,Partially cloudy,Partly cloudy throughout the day.,â›…,"VOMM,43279099999,43278099999"
Chennai,27/1/16,31,22,26.5,33.7,22,27.4,20.1,69.2,0,0,0,,0,0,23.8,14.8,88.4,1012.9,29.6,5,244.6,21.2,8,,2016-01-27 6:35:50,2016-01-27 18:07:13,0.6,Partially cloudy,Partly cloudy throughout the day.,â›…,"VOMM,43279099999,43278099999"
Chennai,28/1/16,32,22,26.4,35.8,22,27.5,20.7,72.3,0,0,0,,0,0,23,11.2,113.3,1013.1,25.4,5.3,251,21.7,9,,2016-01-28 6:35:46,2016-01-28 18:07:41,0.64,Partially cloudy,Partly cloudy throughout the day.,â›…,"VOMM,43279099999,43278099999"
Chennai,29/1/16,32,22,26.2,34.9,22,27.1,20.8,74.3,0,0,0,,0,0,23.4,13,83,1014,23.2,5.8,242.6,21.1,9,,2016-01-29 6:35:42,2016-01-29 18:08:09,0.67,Partially cloudy,Partly cloudy throughout the day.,â›…,"VOMM,43279099999,43278099999"
Chennai,30/1/16,33,22,26.2,36.1,22,27.1,21,75.1,0,0,0,,0,0,22,18.4,55,1013.8,32.4,5.3,238.5,20.6,9,,2016-01-30 6:35:36,2016-01-30 18:08:36,0.7,Partially cloudy,Partly cloudy throughout the day.,â›…,"VOMM,43279099999,43278099999"
Chennai,31/1/16,32,22.8,26.3,34.2,22.8,26.8,20.4,72.6,0,0,0,,0,0,22.3,11.2,74.7,1013.4,32.6,5.3,233.7,20.2,8,,2016-01-31 6:35:30,2016-01-31 18:09:02,0.73,Partially cloudy,Partly cloudy throughout the day.,â›…,"VOMM,43279099999,43278099999"
Chennai,01/2/16,32.4,21,26,33.8,21,26.8,20.2,72.8,0,0,0,,0,0,23,18.4,64.7,1013.3,33.6,5.3,250.6,21.6,9,,2016-02-01 6:35:22,2016-02-01 18:09:28,0.75,Partially cloudy,Partly cloudy throughout the day.,â›…,"VOMM,43279099999,43278099999"
Chennai,02/2/16,33,20,25.9,32,20,26.2,19.4,71.6,0,0,0,,0,0,19.8,9.4,100.4,1013.7,14.1,5.7,252.4,21.7,9,,2016-02-02 6:35:13,2016-02-02 18:09:54,0.8,Clear,Clear conditions throughout the day.,â˜€ï¸,"VOMM,43279099999,43278099999"
Chennai,03/2/16,32,22,26.1,32.8,22,26.5,20.1,72.8,0,0,0,,0,0,19.8,11.2,82.2,1012.9,24.8,5.8,242.2,20.8,9,,2016-02-03 6:35:03,2016-02-03 18:10:18,0.83,Partially cloudy,Partly cloudy throughout the day.,â›…,"VOMM,43279099999,43278099999"
Chennai,04/2/16,32,22,26.4,32.6,22,27,20.6,72.9,0,0,0,,0,0,25.6,11.2,79.9,1013.1,21.2,5.7,253.5,21.8,9,,2016-02-04 6:34:52,2016-02-04 18:10:42,0.86,Partially cloudy,Partly cloudy throughout the day.,â›…,"VOMM,43279099999,43278099999"
Chennai,05/2/16,32.3,23,27.2,34.2,23,28.1,20.6,69.7,0,0,0,,0,0,24.8,16.6,89.9,1012.8,44.2,5.5,244.2,21,9,,2016-02-05 6:34:40,2016-02-05 18:11:06,0.89,Partially cloudy,Partly cloudy throughout the day.,â›…,"VOMM,43279099999,43278099999,remote"
Chennai,06/2/16,30,23,26,32.6,23,26.9,20.9,74.4,0,0,0,,0,0,26.6,14.8,73.8,1011.4,42,5.4,208.5,18.1,8,,2016-02-06 6:34:27,2016-02-06 18:11:29,0.92,Partially cloudy,Partly cloudy throughout the day.,â›…,"VOMM,43279099999,43278099999"
Chennai,07/2/16,32,23,27.3,36.8,23,28.9,21.5,71.5,0,0,0,,0,0,28.8,14.8,72.3,1012.8,51.4,5.6,231.2,20.1,8,,2016-02-07 6:34:13,2016-02-07 18:11:51,0.96,Partially cloudy,Partly cloudy throughout the day.,â›…,"VOMM,43279099999,43278099999,remote"
Chennai,08/2/16,32,24,27,35.8,24,28.2,21.6,73.6,0,0,0,,0,0,27.7,18.4,71.5,1012.3,34.9,5.4,244.1,21.2,9,,2016-02-08 6:33:58,2016-02-08 18:12:13,0,Partially cloudy,Partly cloudy throughout the day.,â›…,"VOMM,43279099999,43278099999"
Chennai,09/2/16,31,23,26.2,33.7,23,27.2,21.2,75.8,0,0,0,,0,0,25.2,14.8,84.6,1012.3,25.3,5.2,258.7,22.2,9,,2016-02-09 6:33:42,2016-02-09 18:12:34,0.02,Partially cloudy,Partly cloudy throughout the day.,â›…,"VOMM,43279099999,43278099999"
Chennai,10/2/16,33,22,27.2,34.2,22,28.2,20.9,71.9,0,0,0,,0,0,27.7,18.4,122,1011.7,20.8,5.5,255.8,22.1,9,,2016-02-10 6:33:25,2016-02-10 18:12:55,0.06,Partially cloudy,Partly cloudy throughout the day.,â›…,"VOMM,43279099999,43278099999"
Chennai,11/2/16,32,23,27.4,33.5,23,28.1,19.9,66.3,0,0,0,,0,0,31,18.4,165.1,1011.2,27,5.9,252.1,21.8,9,,2016-02-11 6:33:07,2016-02-11 18:13:15,0.09,Partially cloudy,Partly cloudy throughout the day.,â›…,"VOMM,43279099999,43278099999"
Chennai,12/2/16,32,23,26.9,34.2,23,28,20.8,71.2,0,0,0,,0,0,27.7,13,133.8,1011.1,29.1,5.9,245,21.3,8,,2016-02-12 6:32:48,2016-02-12 18:13:34,0.13,Partially cloudy,Partly cloudy throughout the day.,â›…,"VOMM,43279099999,43278099999"
Chennai,13/2/16,31.3,23,27.1,34,23,28.6,21.6,73.4,0,0,0,,0,0,28.8,13,110.1,1011.8,38.7,5.2,250,21.6,9,,2016-02-13 6:32:28,2016-02-13 18:13:53,0.16,Partially cloudy,Partly cloudy throughout the day.,â›…,"VOMM,43279099999,43278099999"
Chennai,14/2/16,30.5,23,26.3,32.2,23,27,20.7,72.9,0,0,0,,0,0,28.4,16.6,108.5,1012.2,38,5.8,251.9,22,9,,2016-02-14 6:32:07,2016-02-14 18:14:11,0.2,Partially cloudy,Partly cloudy throughout the day.,â›…,"VOMM,43279099999,43278099999"
Chennai,15/2/16,31,22.7,26.8,34.3,22.7,28.4,21.4,73.3,0,0,0,,0,0,30.6,18.4,78.2,1013.4,37.9,5.2,201.8,17.3,7,,2016-02-15 6:31:45,2016-02-15 18:14:29,0.25,Partially cloudy,Partly cloudy throughout the day.,â›…,"VOMM,43279099999,43278099999"
Chennai,16/2/16,31.8,23,27.1,34.9,23,28.3,21.6,73.7,0,0,0,,0,0,34.6,20.5,59.2,1013.8,36.8,5.6,253.1,21.9,9,,2016-02-16 6:31:22,2016-02-16 18:14:46,0.27,Partially cloudy,Partly cloudy throughout the day.,â›…,"VOMM,43279099999,43278099999"
Chennai,17/2/16,32,24,27.8,34.9,24,29.8,22,71.7,0,0,0,,0,0,34.9,18.4,56.5,1013.6,41.3,5.8,172,14.9,6,,2016-02-17 6:30:59,2016-02-17 18:15:02,0.31,Partially cloudy,Partly cloudy throughout the day.,â›…,"VOMM,43279099999,43278099999"
Chennai,18/2/16,32,24,28,34.5,24,29.3,21.6,70,0,0,0,,0,0,33.1,22.3,62.1,1013.7,31.8,6,256.1,22.2,9,,2016-02-18 6:30:34,2016-02-18 18:15:18,0.34,Partially cloudy,Partly cloudy throughout the day.,â›…,"VOMM,43279099999,43278099999,remote"
Chennai,19/2/16,32,24,27.6,34.9,24,29.6,22.6,75.4,0,0,0,,0,0,28.8,16.3,69.9,1014.4,31.2,5.9,263.2,22.7,9,,2016-02-19 6:30:09,2016-02-19 18:15:33,0.38,Partially cloudy,Partly cloudy throughout the day.,â›…,"VOMM,43279099999,43278099999,remote"
Chennai,20/2/16,33,24,28.3,39.3,24,31.4,23.6,76.8,0,0,0,,0,0,28.1,18.4,105.5,1014,29.6,5.6,265,22.9,9,,2016-02-20 6:29:43,2016-02-20 18:15:48,0.41,Partially cloudy,Partly cloudy throughout the day.,â›…,"VOMM,43279099999,43278099999"
Chennai,21/2/16,33,25.5,28.6,38.1,25.5,31.5,23.7,75.9,0,0,0,,0,0,30.6,18.4,134.3,1012.7,28.6,5.8,257.5,22.2,9,,2016-02-21 6:29:16,2016-02-21 18:16:02,0.45,Partially cloudy,Partly cloudy throughout the day.,â›…,"VOMM,43279099999,43278099999"
Chennai,22/2/16,33,25,28.1,37,25,30.3,22.9,74.6,0,0,0,,0,0,33.5,22.3,152.2,1013.2,27.3,6.2,265.2,23.1,9,,2016-02-22 6:28:48,2016-02-22 18:16:16,0.5,Partially cloudy,Partly cloudy throughout the day.,â›…,"VOMM,43279099999,43278099999,remote"
Chennai,23/2/16,32,23.6,27.8,34.9,23.6,29,21,67.9,0,0,0,,0,0,32,18.4,148.8,1012.7,25.8,6.2,263.8,22.7,9,,2016-02-23 6:28:20,2016-02-23 18:16:29,0.52,Partially cloudy,Partly cloudy throughout the day.,â›…,"VOMM,43279099999,43278099999"
